title,score,subreddit,comments
Business Idea Assignment Help,2,disability,"Some /questions:

1. How would you try to make it affordable? Disabled people are disproportionately low-income.

2. Would promotional materials acknowledge that certain types of exercise can be harmful for certain disabled people? Like the harms it could do for ME/CFS.

3. What Covid-19 precautions would be in place for one-on-ones? Could there just be an online version for those of us doing work outs alone in our room?

4. What steps would you to make sure that online components are fully accessible?

5. Would information about this program also be available in plain language?
I’m glad you’re thinking of the disability community. There’s not enough out there. There are a few, AMG fitness comes to mind
https://www.amgfitness.org
Keep in mind, a business like this will also appeal to elderly folks wanting to stay active."
I think most of us can agree we would be happier if we didn’t have  a chronic illnesses/disability (vent),51,disability,"It’s kinda like, well be grateful you don’t have to stress about bills or rent. That doesn’t make me feel any less depressed. In fact, I envy that’s what able bodied people have to worry about. Not that their health is declining or they are losing mobility year after year. 

I think I just need to sort out my thoughts and feelings on my own and not come to her. I hope eventually I can get to a point where my disability doesn’t bother me as much but it will take a long time.
My doctor had told the same thing. MD doesn’t cause pain. In a sense, it is true. It doesn’t cause pain directly but it does causes other muscles to compensate for the weak ones and that what causes the pain. Yet if we didn’t have MD we would not be in pain at all. So the way I see it is MD does cause pain no matter how you look at it. 

He won’t prescribe me anything either. He said to try and use mobility aids and see if that helps. I wish doctors could experience what it is like to have MD and see if they could do their job without pain killers. Would they even be able to keep up with their job with MD?Probably not!"
"I’m becoming bitter at a friend calling themselves disabled, and I don’t like it",155,disability,"I had to fall and hit my head twice before I started using the mobility aids my doctor wanted me to use. I don’t go out in public due to being embarrassed and afraid I’ll fall in public. I’m sorry you feel the way you do, and I’m terrified for you falling in public and hurting yourself any more than you already have. I really admire how you have become comfortable with the label and being disabled, I still really struggle with it but I’m working on it. I read you use your wheelchair, walker, and braces, maybe you could have someone help you get around when you have to go out? I dint mean to sound insensitive, i just know falling on top of everything else can not be good and sounds so scary.

There does seem to be some weird thing going on now people want to be or claim to be disabled. My friend said it must be nice to get pity and sympathy and have people try to accommodate me best they can. I was completely taken aback by that remark, and have put a lot of distance between us. Maybe have a serious conversation with your friend how insensitive and tone deaf they trying to one up your disability makes you feel. If they disregard your feelings, maybe it’s time to take a break from the friendship.
It's hard, because they probably don't realise what they're doing, and maybe they're responding to you in the way they would like to be responded to (if you catch my drift). I think some other people further up the thread had some good ways to break it to them that they're making you feel bad.

I think some people feel the same way as you do if I talk about being disabled (fibro/CFS, T1D, hypermobility syndrome, clinical depression/anxiety, migraines, autism, gastroparesis and IBS in my case) because they've got something more obviously disabling, like cerebral palsy, cancer of some kind, serious hearing loss, limb paralysis etc and I do get it, but I still need to describe my own problems to other people in a way they'll understand without drifting off. I guess we all just need to be mindful of others' issues somehow.
TL;DR Don't think you are a gatekeeper but rather suffer from your friends (unintended, I think) ""trivialisation"" of what you are going through. Good luck on maintaining that friendship and making the situation more comfortable for both of you.
___
I only have one mental disability (if depression doesn't count) and thought at first what you mentioned later: Oh, another gatekeeper. But the further I read, the less it seemed to me that you were gatekeeping at all. I don't like to compare illnesses in a contest like way, since depression seems like nothing compered to the struggles life have in store for others, yet still the mortality rates for depressions alone are scaring.

Yet what you describe, in my opinion, isn't about disability, but about making your struggles unseen by trivialising them. It is like … I am from Germany and we have here the nasty history about Nazi-Germany, the second world war and the Shoa, the mass-killings of jewish (and other) people. And therefore a law, that prohibits the trivialisation of national socialism, because it makes the victims and their sufferings unseen, if somebody, for example, compares unpleasant and unjust experiences with the mass-killings and torture in the so called ""Third Reich"".

I think that, on a different scale, you are fighting a similar conflict as you are not really gatekeeping (you never told your friend off or corrected them, when they mentioned an illness to others without saying, that they ""only"" self diagnosed themself, etc.), but that you struggle with your friends (unconscious, I think) attempt to trivialise the magnitude of your struggles, by comparing them with … far lesser (appearing?) common sufferings.

Like … someone here posted, a few days ago a screenshot of a post in an amputee subreddit of a women who has broken a finger and asked, in earnest, the amputees for advice how to deal with this, for her new, reality. It wasn't, in my opinion, gatekeeping either, when one user there told her to f*** herself with that broken finger she still had. Comparing ones own life with a **broken finge**  to that with the lives of people, who had lost their limbs … makes the struggles of the tatter unseen, as one might think ""*well, I've broken my finger once, and it did hurt, yes … but if that's all, an amputee have to suffer from, they really should get a grip and go on instead of …*"".

Really, I understand (no, not your MS, but) your annoyance with your friends (I think unintended) trivialisation of your sufferings. I think (but please be carful when following my advices, for I have for reasons no friends at all), that you …

- should explain to your friend, what harm their comparing do to you, so that they maybe keep it to themselves. That alone isn't gatekeeping, I'd say.
- accept if the continue labelling themself and for themself - even if they don't do the physio-exercises nor seek official diagnosis, etc. Because invisible disabilities ""can"" be more harmful, than they appear and one can never be really sure of the magnitude of another persons suffering - or so I think. If self-labelling helps them - why not? (As long as they don't harm others that way, by trivialising their struggles or taking away much needed resources, etc.)

Honestly, I don't see you as a gatekeeper at all. And think that your annoyances are quite understandable and reasonable. I hope you'll find a way to hold that friendship **and** find a way to stop letting your friends behaviour harm you as well.
My therapist (who was already solid, after a long time of me searching for one) became disabled after a few months of first seeing her. She had to take some months off and I don’t know the details of her condition (unnecessary), but she has disclosed that she has gained some of the same health struggles I have, some of which are more severe. It’s been pretty healing (seemingly for both of us) to be able to talk about the realities of this and the process of acclimating to these things. She was already very compassionate but the not needing to explain all of it is actually really nice, that a lot is just understood. Obviously I wish her health crisis hadn’t happened at all, I’ve had some years to adjust to my situation and can manage emotionally with most of it now (thanks in part to my husband also losing his health near the same time I did, though before we were together). I hate that she’s going through this shit too. But I can also definitely vouch for the ways having a disabled therapist can be healing. 

A very minor point, but when OP mentions the friend dances and still maintains a social life, well I can get the bitterness (I was functionally bedbound and extremely isolated for several years), but outside of trying to keep up that lifestyle potentially damaging the friend’s recovery/maintenance plans I will say that this might be a tiny bit reductive. My health issues are more severe it seems than their friend’s - I have constant and severe back pain that often means days in bed at a time, plus neurological issues from the same cause and having to catheterize as well as the regular infections that can come with that, which I’ve always been prone too. But even though my bad days outnumber the good ones and minor household chores can be enough to wreck me for days (I’m not nearly consistent enough to work), I have made some small improvements over the last couple years from my previous state of basically being wholly unable to take care of myself. And when I’m able, I try once a week to have one night to regularly socialize and often enough dance. Losing my physical functionality and my muscles atrophying into uselessness was pretty traumatic in itself, but the isolation was probably more life threatening. I was in extremely deep depression and even with my husband there for me felt very isolated, like I was no longer part of the world around me. 

Since I finally found decent doctors who will treat me (I was “too young for chronic pain,” regardless of the ten inch scar down my spine and obvious history of spina bifida) making sure I have some social outlets and sources of small joys had been a priority. I was losing my sense of self so badly, just being able to be around other people once a week has had such a huge impact and given me more strength and support to draw on during the bad days (which happen regularly whether or not I go out occasionally). I used to hate dancing due to self consciousness and how even before my crisis my body hurt and was misreading nerve signals. But honestly, I kind of love it now. I take it easy, mostly dance at goth nights (as you can kind of dance however you want to for that lol), and I do need to rest more the next day. But idk. It sparks joy to be able to use my body at all now. To be able to do anything remotely fun in it. I’m willing to take on some extra aches on top of my baseline pain for that, and honestly it’s helped motivate me to gently exercise with an easy outlet that can be as rigorous or gentle as I need it to be. It’s a luxury that not everyone gets, but I’m extremely glad I get to do it. Before I was able to rebuild any social life I mostly existed in this horrible state of suffer through, wait, try to believe that things can someday be better. That and my husband kept me from suicide at many points right after I’d lost everything with my health (my dream job, my sense of self, even most of my family since they treated me as “choosing to be weak”). But it’s not sustainable and finding small joys to live for, even if they expend some of my precious energy, has been incredibly helpful. 

I hope the friend learns to moderate between what they are used to and what they need to take care of themselves. But I honestly hope they can keep that zeal for life, keep having social outlets, keep dancing. It’s understandable for OP to feel bitter about it, the way the friend is trying to “relate” by constantly recenter themselves is irritating as hell, and there should probably be either a conversation or some distance. I felt pretty damn bitter when I was watching the world pass me by in the immediate aftermath of my health crisis, back when I still didn’t have coping tools and everything was so new and overwhelming. It’s fair to not want to be reminded of the things OP can’t do especially while this is fresh. But I also think we should try not to be crabs in a bucket to each other or police how people manage their health too much. Even with relatively minor health issues (at least compared to what many of us deal with) it’s understandable for people to cope differently and want to hold onto things that bring joy when possible. 

I also don’t like the idea of particularly able bodied people being like “well you can dance, you must not *acshually* be disabled” when for a lot of us the degree of our limitations is highly variable on the day and it’s the overall inconsistency of health that makes things the most challenging. Like for me most people will not see me on the bad days because I literally can’t leave the house. Of course I’m going to look more well to them than is representative of my reality. And the few times I’ve needed to be around people (other than my husband) on the bad days (which again, more days are bad than good even now) the shock at what that looks like is visible - on some level they just assumed I was exaggerating 🤷🏻 I’m not going to give up the few little things I have that keep me going to appear “disabled enough” for people who will always look for a reason to ignore the needs of disabled people.
EDS is Eherlos Daniel Syndrome - it's hyper mobility in your joints
It's like the example of someone in a wheelchair.   They are mostly perceiving that they get to sit down wherever they go.   Not how much difficult that really makes life.   That these disabilities prevent us from being truly independent in our lives.   

These kinds of people take for granted their own abilities.  They can't see how much quality of life  Diminishes, more dependent someone is.   

It's concepts that they can't wrap their head around because they've experienced nothing that prevents them from being independent.   

For example,  The simple act of just getting dressed in the morning.   They can get themselves dressed and they can decide to go somewhere's for the day.   They don't have to take into account how their currently feeling,  The time and effort it takes to get dressed.  Even the thinking process that goes along with how to accomplish these tasks.  The energy levels after completing these tasks which takes so much more energy than the average person.  

You have to think about how you're going to be safe if you want to even go to groceries.   Maybe transportation issues because you can't walk,  Or always being in a state of Anxiety because you don't have full control over the actions of your own body.  

I personally always have anxiety because I'm more vulnerable than the average person.  If I get triggered I risk my body collapsing and  completely vulnerable to any stranger coming up to me.   

To an everyday average person living that regular lives,  Could be life-threatening to me or other people with disabilities.   I don't think they understand because they've never had to live With everyday choices being a risk to their life.   

And people Struggling with real disabilities,  Don't want their disabilities.   I'm speaking in general I'm sure  There are always exceptions.  

I firmly believe most people would rather try to live and average everyday life where they're independent and they can choose to live their life the way they want and do what they want.  They have to revolve their lives around their disability.   Not  Because they choose to ,  But because there is no other way around it.  

I find a general good way to tell a difference between someone who is really struggling and trying to live life with disability, And someone who's following the trend,  Is there behavior and how the act towards it.   Most people and I'm saying most because like I said before there are exceptions,   Don't like to bring attention to their disabilities.  Unless it's for education sake.   

They don't want to be seen for their disability.  They want to be seen for who they are as a person.   And these people make what they consider a disability their whole personality in life.   They go out of their way to bring attention to themselves.  But they show no signs of trying to do anything to help themselves.  

There's a kind of arrogance in their demeanour.   And whether they are truly disabled or not it just shows that a personality is c***** and that their self-centered.
It’s sad that all of us had the same experience with medical.  I just happen to be very stubborn, so after hearing that I just had to “maybe try a cane” because I was only 40, I bought a used mobility scooter.  It changed my life so radically that I knew it couldn’t be wrong to use!  
Our doctors tell us that we should have a bunch of options to deal with our issues, a “toolbox” of things, from medication, various talk or physical therapies, exercise, diet, etc, an appropriate mobility aid is not to be feared!  My roommate and I (we both use wheelchairs, I’m able to walk in the house, she can do a couple of steps) are prime examples.  When we each got our wheelchairs, we both LOST weight, because we were able to cook and shop far more easily!  Yet we chose to purchase our own mobility devices (and yes, we are both lucky we have that ability), because we only qualify for a walker to shuffle a few feet…. Our chairs keep us lively and independent, but for some reason, that’s not a good thing, lol?"
i love this. furries are cool actually ,581,disability,"Any conventions in Canada or USA? I have a passport 🥺 love furries
I would legit attach some of these to my mobility aid or backpack. I love this so much! "
Handicapped parking,20,disability,"A placard let’s you park in a handicapped spot, period. If your doctor signed off, you are deemed disabled. Don’t overthink this. It’s commendable to think of others but using your logic, you should never use your placard because someone with more severe mobility issues would always “need” it more. Just park where you need to, to keep you & your child safe.
As someone with a placard for my mostly invisible disability, (which I always need mobility aids for, sometimes a wheelchair,) ignore the haters and do what you feel is best. If you need the space, use the space. No need to feel guilty about it, or rationalize to yourself how to use it. Do what you need to do to keep your kid safe! Where I am, there are also spaces for moms with kids. If you have similar, you could always use those if you can't make yourself use the disabled spaces. They're also right up front. 

I do know what it's like. The first time I was approached and judged for using a disabled space, I went home and cried the rest of the night. I've grown a very thick skin since. They don't know you or what you're going through. It sounds like you'd qualify just for your ankle issue alone, let alone dealing with your son. So go ahead and use the space. As long as the person has a placard, that's all I care about. It's all the people parking there without one that I take issue with."
making disabled friends?,5,disability,"I have no idea about your physical condition, but have you considered trying sports?
 
It's the best thing I did for myself.  Improved my body and met many people (disabled and not). 

So you could do some research if you are interested in sports and I'm sure you'll find something!
Sounds perfect to me! Also, because you said about heart issues, there is a sport for only ""heavy"" disabilities that is called boccia.  So this is something totally safe for you. You could check that as well! Wish you the best of luck!"
Mental and Physical - annoyed (a work rant),3,disability,"Ugh you get it. It doesn't get easier but it's just...annoying? I am not powerchair yet but not far off, how did it help your mobility? Is it easier to get to shops and the like or harder because of the need to transport the chair? Hope it's not rude to ask! Just hoping to find good recs for when that day comes. Because it WILL. 

  
Also thanks for just being honest and saying it won't get better. It won't. I know that. You know that. Platitudes don't make it better, but someone being real with you...that makes it better. :)
Powerchair basically made the difference between being trapped in the flat, completely dependent on others (usually strangers) and a reasonable amount of self sufficiency.

Where I live, within 15 minutes walking distance, there’s about 5 drugstores, 2 huge groceries and another small one, 5 discounters, multiple Cafés and bakeries not counting those in the grocery stores, 3 butchers, a very high quality perfume and makeup and such store, multiple pharmacies, 4 hairdressers and 3 parks. And iirc 3 or 4 are not accessible to me. Every other store I can go in, look around, get assistance as needed for articles on high or low shelves, check out, pay, pack my purchases all by myself if I want to.

Yes, it complicates transit somewhat. I use public transit as much as possible, and a disabled transport taxi service. When DH and I want to go somewhere in a car, we’re stuck with an uncomfortable old folding manual chair, but we’ve managed to make do.

If at all possible, look into the ottobock selection of powerchairs. You can choose standard rear wheel drive, or get front wheel drive (or even middle!) and they look good while being built like tanks. Almost indestructible.

Direct honesty is the least you deserve. I just hope you’re spared the path my progression chose to take. I turn 40 soon, but my heart is so damaged that I repeatedly get warnings from medical professionals that I’m on borrowed time. Ugh! Stupid fucking bodies! *hugs*

DM me anytime you need to vent or anything."
Update on my life,1,disability,"Have you ever been tested for hypermobility?
I have a feeling it's EDS but I haven't been through the hyper mobility test. My mom has EDS too so it wouldn't be shocking."
Gifted kid turned physically disabled teen,15,disability,"I can't speak to ""gifted"" as that category isn't used in my country, but I would highly recommend adaptive sport for improvement of mental health following physical disability. I wasn't a child when I became physically disabled, but I was midway through my MSc, and sport is essentially what kept me together when I was having to navigate a new reality post-impairment during a stressful time. 

May be worth researching and seeing if there are any para/adaptive sport groups that she could join."
Question for disabled folks,4,disability,"I would go rollerblading immediately. Followed by cave diving, followed by running, followed by cliff diving. (I used to be an extreme sports athlete before my disability got bad.)
I would be freaked out for a full day and then I would sign up for a marathon. Or bungee jumping or go get a passport and go to every country I can.
That happened to me once. I have a brain injury plus a brain stem injury so I have various mobility and cognitive impairments.  
  
So like in your post, when I suddenly was ""able-bodied"" in every way, it absolutely freaked me out and I was scared but then started to get happy when my hands and arms worked and I could walk well without losing my balance and needing supports. As an aside, I have always considered myself lucky because with my regular testing and hospital visits, I see people far worse than me.

Anyway, my initial shock or worry was replaced with joy and I became more and more ecstatic until I fell over into a pool or river of smelly gel or poop and then woke up.  
  
Yup, it was all a dream for me. However, I think that is how I would likely feel in real life."
Any good movies/books with main characters who are physically disabled?,9,disability,"I just finished a space opera trilogy (the Final Architecture) by Adrian Tchaikovsky, where one of the main characters is doesn’t have the standard compliment of limbs and uses a few different mobility devices to compensate. She’s portrayed quite well IMO, not just for sympathy and not as a supercrip either. There are spots where she’s genuinely in trouble that an able person would not be."
