title,score,subreddit,comments
"do able-bodied people with somewhat sedentary childhoods get like this? do their bodies start ""giving out"" on them around age 25?",25,disability,"Yeah I agree, it’s possibly your hypotonia kind of “catching up” to you or something else underlying. Healthy sedentary people might have some temporary pain from increased exercise or be more at risk of injury from not warming up/escalating exercise correctly but not to this extreme? I’m glad your doctor seems on top of referrals to specialists. 

FWIW I’ve always had mildly lower core muscle tone and I was in OT for something sort of related. We tried starting to work on it but I didn’t tolerate it well and my OT said it would be very long term/slow. It’s not so bad that I felt up to that at the time haha (it’s more that I can’t do stuff like rock climbing or treading water, doesn’t affect my posture like yours does), but I have been slowly trying some yoga that focuses on that. But yeah maybe getting into PT/OT could help even if it is slow going like mine said. 
A few things about your post really stand out to me. If you have POTS, it's extremely common to also have some form of Ehlers-Danlos Syndrome (EDS). That usually presents with hypermobility, joint and/or tendon pain, frequent joint dislocations or subluxations, things like that. Only a few types of EDS have been genetically sequenced so getting gene testing isn't necessarily guaranteed to produce an answer for you on that disorder.

And when it comes to you going to the gym and PT but never having it feel ""easier"", have you always experienced this at all ages when it comes to any type of exercise, where it feels like you should be building muscle but you haven't? Have you ever been evaluated by a neurologist? Do you have an abnormal walking gait/do you waddle when you walk? Do you have abnormally large calf muscles? Do you experience scapular winging (where your shoulder blades stick out from your back when you hold your arms straight out in front of you), have had problems in your childhood/teens with getting down to/up from a sitting position on the ground (and especially if you've never been able to get up/down like your peers via essentially doing a squat)? Have you ever gotten blood results back that came with very high liver enzymes or a high bilirubin? There are a few types of Muscular Dystrophy that can basically show no/very mild symptoms until around 20's-40's, especially ones like Limb-Girdle, Becker, and Charcot-Marie-Tooth (all forms of Muscular Dystrophy). There are a LOT of subtypes for these specific types of MD, and even people with the same subtype can vary wildly in their symptom onset, disease progression, and severity of symptoms, but these diseases are very rare, so definitely don't freak out if any of this sounds familiar, just be sure to bring it up to your doctor as soon as you can.

I usually don't like to do the whole ""armchair diagnosis"" thing, but I have Limb-Girdle MD type 2i and your post sounds almost exactly like something I would have wrote like 15 years ago lol. Let me know if you have any questions and I hope you find the answers you're looking for ❤
i figure the hypotonia is catching up with me, the neurosurgeon and his PA i spoke to about potential chiari (i have slightly low cerebellar tonsils but apparently whether something counts as CM-1 depends on the diagnostician) & spine problems didn't seem to be a concerned much at all about hypotonia that doesn't seem to have gone away since childhood, PCP is willing to refer me to a neurologist once i get other more pressing stuff out of the way first which i agree with since i'm a full-time student & this stuff isn't as concerning as the gynecological disorder doing things like causing me very severe leg pain, worse than anything the low muscle tons has ever led to

and aaahhh!!!!! i love swimming, that was my fav sport they made me try but i couldn't keep up with my peers & had to drop out for other reasons as well, my school used to have a pool but they shut it down due to lack of finances for upkeep 😔
my OT had to google what hypotonia was (which is funny because it's not really a common thing?) & my last attempt at PT had me leaving in tears because i felt like i wasn't really being understood/taken seriously & that feeling activated the trauma from my child abuse/medical neglect, so yeah that didn't go well

i'm willing to try PT again at some point (hopefully before i lose my medicaid) but i really want a better picture of what's going on at first so i can stop telling people these vague things & ""maybe's"" and maybe also find a PT familiar with what my issues are instead of just any old PT, i might see about it over the summer depending on what happens between now & then since it wouldn't work well with my class schedule right now

i have hard time with coordinating different muscle groups at the same time to properly do some exercises though (potential chiari has been dismissed so maybe undx'd dyspraxia), they had to cue me on stuff up until i was discharged so there was minimal improvement in that area & that's something that gets in the way of doing stuff on my own which is kinda what's necessary for PT, very annoying

i wish my parents got me PT as a kid 😔
i have generalized symptomatic hypermobility but any joint instability has stopped being an issue since i started taking continuous birth control so while i think hEDS (if not gHSD, i was denied for genetic testing but the only genetic form i fit the symptom profile of is pretty rare - clEDS - so unlikely) is a possibility getting that exact dx isn't a priority for me atm, and no, to my knowledge i've never seen a neurologist, though i plan to

i was dedicated to the gym last summer, and i may have been seeing improvement in the context of the gym (i wasn't really keeping track but all i can say now is that after a long break i'm having a much harder time getting started again than i did the first time i started), but specifically what i meant about the ""getting better"" part is less gym performance and more not seeing improvement in being able to do my part-time job or ""ordinary"" life things requiring physical effort (including having good posture and being able to sit at my desk), so i can't really say for sure if i haven't been able to build muscle

as for other stuff:

- i think i waddle but only contextually, like depending on how i'm feeling, most days i don't think i do, according to my first PT session i have some mild gait abnormalities like bilateral trendelenberg, neurosurgeon i recently saw said i had a normal gait & no signs of muscle atrophy
- no clue about the scapular winging (edit: took a look, doesn't seem like it, not when i hold my arms out)
- afaik my calf muscles are normal, i don't know what would qualify as too big but they seem normal to me
- as for getting up, i've always had some level of difficulty/preference for using my hands or the support of something else to give up, i forgot the name for the specific ""sign"" that is getting up in a certain way that indicates some type of weakness, is that what you're referring to? squats in the gym are REALLY hard on me, i know that, & if i deep squat i risk my muscles not letting me go up immediately, i don't think that's what you mean though
- no idea about bilirubin & the only time i think i've had high liver enzymes is when i was in the hospital for an overdose on tylenol, so probably not relevant lmao

hopefully a neurologist will be amenable to looking into the muscle stuff & my nerves being shitty (lifelong paresthesias) but we'll see - i appreciate your input! also yeah, i recently learned CMT-2 was even a thing, let alone there being like 80 of them lmao
I also have congenital hypotonia for me my issues were caused by a connective tissue disorder (Hypermobility spectrum disorder).
i had a pretty bad bout of influenza once but that was so long ago i couldn't say whether or not that was the trigger, i also have generalized joint issues + generalized hypermobility but any pain/other problems related to that have virtually disappeared since taking continuous birth control so seeking evaluation for possible hypermobile EDS (i was denied genetic testing due to lacking certain clinical criteria so monogenic EDS is unlikely i guess) or generalized HSD isn't as high a priority on my list as all the stuff i have that sometimes occurs alongside it (on top of the fact there's no medical professionals around me who know enough about that stuff), for the POTS getting testing for potential SFSN/other nerve problems is something i'd seek out before anything to do with hEDS or gHSD"
What was the breaking point that made you get a cane/other mobility aid?,5,disability,"I'd get a Mobility Scooter if I could, but even second hand they're over £700 (WTF?!)"
AITAH for not wanting to meet in the park for the first date as a physically disabled woman?,112,disability,"Why did he want to go to a park? 

Personally I'm immunocompromised in addition to my mobility impairment so I will only do the first 3-5 dates outdoors for safety reasons. 

There's no reason for him to be rude or pushy regardless but I'm wondering if it was a case of opposing access needs.
Honestly, as someone whose not in a wheelchair 24/7 and occasionally uses a cane for mobility assistance..

Hell I wouldn't meet someone in a park when I was (more) able bodied for a first date unless I already knew them really really well. 

First date out of the blue which is also first time meeting someone in person? I ain't meeting that person in a park. I ain't going on a hike as a first date. 

And hell, if they're doing that much pushback on something as simple and unthreatening as where our first (0date) date is gonna be at, my hackles are raised. I'd begin thinking dating this person was actually a bad idea and seriously consider unmatching and blocking the person. 

So many red flags.
That makes a lot of sense and is more context than just being in a park, thanks for the clarification!

  
I live in a city and often suggest parks as a first date option because it lowers cost, either of us can bail immediately (no waiting for a check from waitstaff) and unless we are going deep into the trails on the bigger parks, they are popular spots often filled with families with children, crafting and language groups, and exercise groups doing stuff like CrossFit and tai chi, so they generally feel safe.

  
Good luck on the dating front!
I never know what to say, though when we “go for a walk” my roommate says we “tootle”. We need more mobility words!"
Saying ‘No I can’t take care of you’ and disability justice. How much is too much/not enough? ,25,disability,"Even when people are getting paid (I have a mobility disability and home health aides), still it is the responsibility of the disabled person to have depth of care and be responsive to the stated and unspoken needs of their caregivers. That way, everyone avoids burnout and resentment.  

Home health aides are often grossly under compensated and many folks work way long weeks, providing crucial services, and because some degree of emotional bond almost always forms, it’s frequently difficult for caregivers to let themselves be  unavailable.
That makes a lot of sense. I can’t imagine it would be easy to have a caretaker say ‘no’ last minute to something like transportation. Thank you for sharing!
I’ve heard stories from a lot of people that the  assumption that disabled people who use mobility aids need help when none has been asked and it sounds deeply, deeply frustrating and awful. In your experience, does this also extend to people asking if you need help? What are things you wished ambulatory people knew?  "
How to develop self-love after disability ,8,disability,">I come from a dysfunctional family to boot. I've escaped my cult after decades of abuse and cut my family and friends all off and had to start over with no one.

The op can't easily do this. She has zero income and mobility issues. So is stuck in her room and will probably be with her family and zero real-life friends unless something changes. She is also in Asia if that helps anyone.

>I use a friendship app to swipe for friends

You should post a link to the app that you use so the op can also use it. 😊

>I am in hobby groups because I have tons of hobbies to keep me company so I'm not depending solely on other humans to keep me entertained.

I assume that you are either looking for ideas or help with your hobbies in these groups. That or you are helping others. Having something to keep your mind busy.

>Meanwhile, therapy should be a high priority with all these negative judgment and assumptions you're harboring.

She might need free and online therapy as she is stuck in her room without income."
Ways to play with my cats more? ,3,disability,"You sound like me! I love tubes and my cats do too! There are many different kinds and lengths and they can fold up for when you need more room. They’re fun to lay down next to and use the cat wands around allowing the cats to “hunt” from inside or behind the tubes. It makes playtime more engaging since I can’t run around with them.

Other than that of course a laser for when they want to run fast but I have to stay in bed. 

Cat trees are great for them to get their climbing in. 

I also sometimes walk them around the block in a stroller so I can use the stroller for support when I walk for exercise. 

Have fun!"
Disabled Mom struggling to take care of baby- Advice needed,42,disability,"My mum has gotten progressively more disabled as my life has gone on. One of my first memories is getting her cane for her so she could get out of bed. I still love her and wouldn’t trade her for anything, and while I sometimes wish that we could’ve done more physical activities together, I never really thought about it until other people pointed it out. I have grieved with her as her health gets worse, but I’m also very grateful that as I’ve developed my own health issues in the last few years that I’ve had someone in my corner who really gets it. No one understands me like my mum *because* she is a disabled parent. She’s also instilled so much compassion in me, and even before I got sick I was much more aware of accessibility needs and ableism than others my age. I’m so blessed to be able to say that her disability has made me a better person. Your child will likely grieve some of the differences in their childhood when they get older, but that will not be the defining characteristic of their life or their relationship with you. Raise them to be kind, compassionate, and resilient. Raise them to know it’s ok to rest even if the masses insist on the hustle and grind culture. Raise them to adapt and have fun with your disability (nothing like decorating a mobility aid to make it flashy haha). 

Sorry I don’t have more practical advice, but I hope this helps. My mum and I have had issues of course, but they aren’t because she’s disabled.
Thank you! I know I try my best to show that to both my baby and my stepson. I have a really close relationship with my stepson despite him being a sports kid and me not being able to very limited sports things with him: I needed that reminder"
Is it.. bad I have a hard time admitting I am disabled?,29,disability,"There's no disability fairy that comes and waves a magic wand and all of a sudden someone is branded ""officially disabled"". For some, yes, there is a defining singular moment. Maybe they became disabled after a traumatic injury, or were disabled at birth. But for a lot of us, we have a gradual decline in health and then have to figure out where we stand and how we feel about it. And it can be a hard thing to wrap our heads around because it's something we have to decide for ourselves.  

Disability is not a dirty word. But society conditions us to believe it is. So yes, it's very normal to have trouble attaching that label to yourself. Everyone becomes disabled eventually, whether it's at age 15 or 85. I didn't feel comfortable calling myself disabled for a year or two after being diagnosed and needing to use mobility aids full-time, even though I'm sure others would have thought of myself as disabled long before then. You're at the beginning of your own journey, and there's a long path ahead. Ultimately it's up to you when on that path you feel comfortable giving yourself a label.
I personally don't think it's bad. I do understand that it can be hard admitting that tho. Have struggled with that a lot myself. I've been dealing with multiple mental health issues since childhood, and after quite a few failed attempts at working, I wound up on disability as an adult. I wasn't happy with it, but I eventually accepted it. Since I have what's considered to be an invisible disability, it hasn't been easy navigating society. After a mild bout of COVID three years ago, we discovered that I have a chronic illness on top of all the mental health issues, and I've had it since my teens. Tbh, this diagnosis came as no surprise. Still, it's been a struggle to accept this. And the chronic illness has been worsening the last several years. It's invisible for the most part now (meaning I don't use any mobility aids), but I may wind up bedbound one day. I've already been getting more housebound as this has worsened. My ability to do day to day stuff has been deteriorating, and it's been so frustrating and scary. I don't want to have this chronic illness or all of these mental health issues. I want to be healthy and able-bodied too. :'(
No! This is absolutely normal and something we all go through and have to come to terms with. It's a real mind f*ck at first, but I promise you it will get easier day by day as it becomes your new norm. Do not feel insecure if people stare at you either! In a lot of people's minds, they invision disability with elderly and seem (are) surprised to see anyone under the age of 65 with a mobility aid... Ignore them or simply make eye contact, and they will look immediately look away, lol"
dealing with disabilities?,0,disability,"Your sports, working out etc doesn't need to be taken away from you. I'm in a wheelchair & keep plenty fit for a 45yr old. I do marathon distances for fun, go out for 10 mile 'rolls' a few times a week. I do okay. We know how good exercise is for mental health. 

A disability doesn't necessarily mean 'the end'. 

I totally understand how you're feeling, my disability started with pain when walking before I ended up losing a leg & ending up in a chair, I felt like my life had been torn from me & honestly I spent a few years in a dark place (not all due to my failing legs), but honestly my life right now is the best it's been. Ever.

Note: I am in no way saying that because you have pain in your leg, that you'll end up in a wheelchair. So please don't read what I've said & panic.
Hi I'm 17 but I was diagnosed with my disability at 14, i use a cane and custom leg braces to walk better and sometimes use a wheelchair. I dance and used to do musical in school and a bunch of other activities. I still dance but I no longer do a lot of my other activities. I at first also felt like everything was taken away from me too. But you can still try to do the things you love it just is a lot harder and you may not be able to do things even when you really want to or try hard to. I'm a dancer I still dance like I said but I often fall or am too painful to dance nor can I dance as good as I used to but I do what I can and take breaks when I must. Some advice I have is do not over work yourself and talk to someone about your disability such as your sport's coach if you feel comfortable enough to do so, they can hopefully understand your situation and they might even have some advice you can try. For instance I did musical 2 years ago and am currently talking to the teacher that runs it to see if I'm able to preform or work something out to work back stage this year. It is unfair to not be able to do the things you like doing and I wish I could say everything was the same when my disability worsened about 2 years ago but it would be a lie. Not everything is easy and I ofc don't know you or your disability but you can still try or try with accommodations because I've learned that even though my disability plays a huge role in my daily life I can still try and not give up on what I love doing. If you don't at least try you will never know what you're capable of even with a disability, there are so many things I gave up when things got hard and I won't lie and say I don't think about giving up dancing almost every day but I love doing it and loving my activities for me wins over how much I have to put in to keep going. I'm very sorry to hear you are dealing with this, it's definitely hard to say what will happen, everyone is different and I hope the best for you
thank you so so much for this, i barely see anybody my age also working with disabilitys, and reading this gave me alot of relief! im glad to hear that you can still do the things you enjoy, even with difficulty. i will definitely speak to my coach and such on things to do so i can still play my sport for the season"
ada seating at concerts,5,disability,"If you know a concert is coming up you want ADA seating at, call the box office the morning of the sales and get ready to buy. They will ask if you have mobility or another disability, like Deaf/interpreter or CART services, or legally blind, etc, and give you some seating options. 
Make sure you have your accessible parking tag as well, from your doctor"
Does the C word bother anyone else?,82,disability,"I've used it a handful of times for myself, but I decided that I didn't like the way it sounded or felt. It made me really uncomfortable. Just like the F slur used towards queer people, like myself. 

I prefer to say that I'm disabled, or just that I require a mobility aid. Although I don't like it when people call my cane ""a stick"".

In both cases, it makes me feel like there's a negative connotation, like I'm being looked down upon for my needs. It makes me worry for when I will eventually need to start using a wheelchair.
Yes I hate it when others use it. I use it in reclamation and as a part of disability pride but every time someone says “cripple the economy” or “oh they’re crippled” or “crippling anxiety” I actually get so pissed and annoyed and sad and angry about how little people understand the history of the word and the violence associated with it. In my opinion, it should only be used by people with mobility disabilities and only as an act of positive reclamation, never should it be used to connotative something bad"
"I don't want my disabled ex to be homeless, but I need them to move out. ",110,disability,"Did your ex also suffer from chronic pain? Mine has chronic pain, a dissociative disorder, and no car. We live in the middle of nowhere, so unless he moves to a place with public transportation, he won't be able to travel on his own. He's in therapy twice a week, and seems more concerned about unpacking years worth of trauma then finding a way out of his current situation. I don't know if he understands how badly I want him gone. I wish he was trying a little harder. Maybe spending more time researching and less time crocheting or playing on the computer. He says he needs the dopamine. I can't tell if I'm being ableisit.
I don't believe they have the mental facilities to take care of themself or plan an exit strategy. I'm starting to wonder if they safest place for them is a living facility with staff on hand. I don't understand how they made it through college... I'd really like them to get a job in their field, but I think they'd need to relocate to somewhere with public transport."
