title,score,subreddit,comments
How to Cope,12,disability,"I used to run track in middle school and high school. Fairly fast but not the best. 51 second 400m, could never break the 50 second barrier sadly. After high school I went into the military because my parents were already paying for my brothers’ college. I didn’t want to be another financial burden and the military was a solution. Few years of service later, I developed knee problems. My fastest two mile in high school was 10:59, not stellar but above average for the most part. After those years of service, knees just worn out, cannot even do 20 minute two miles. And that’s just depends on if I even last the two miles.

And then this past year, I got into a motorcycle accident. Leg was twisted and I was confined to a wheelchair during my initial healing process. Nothing broken, but my tendon was really bad. My knee for that leg is now maltracking and I am stuck with my cane. If I walk without a cane, my leg makes very **very audible popping and cracking noises.** And don’t get me started on the distance I can walk.

I can run, but after a minute of running I basically have to sit. And my running is a shadow of what it used to be. Compared to where I used to be, it has been a slow descent through depression. 

My advice is to get therapy to help navigate your feelings. My coping mechanisms is the gym. I can still go to the gym and machine workouts and do pull ups and dips and other things that don’t involve heavy lifting with my legs. But I suppose what I’m trying to say is you shouldn’t narrow your headspace just because it feels like the world is closing in.

Seek help and improve yourself at your own pace.
Definitely consider a CBD salve for targeted pain relief.

A [salve](https://www.organicgrit.com/products/1500mg-cbd-salve?_pos=1&_psq=Salve&_ss=e&_v=1.0) is a great choice because it lets you apply relief directly to where it hurts, unlike oils or gummies.

Take a look at the CBD Salve from OrganicGrit.com. It’s made with natural ingredients like bee wax and peppermint, avoiding harsh chemicals and NSAIDs.
All their products are verified by third-party labs, specifically SC lab in Denver, Colorado.

Also check out [The Science of CBD Topicals: Organic Grit CBD Salve for Deep Pain Relief](https://www.organicgrit.com/blogs/news/the-science-of-cbd-topicals-organic-grit-cbd-salve-for-deep-pain-relief?_pos=1&_psq=Salve+and+pain&_ss=e&_v=1.0)and [CBD and Arthritis: Easing Joint Pain and Improving Mobility](https://www.organicgrit.com/blogs/news/cbd-and-arthritis-easing-joint-pain-and-improving-mobility?_pos=1&_psq=Arth&_ss=e&_v=1.0).


A [salve](https://www.organicgrit.com/products/1500mg-cbd-salve?_pos=1&_psq=Salve&_ss=e&_v=1.0) is a great choice because it lets you apply relief directly to where it hurts, unlike oils or gummies.

Take a look at the CBD Salve from OrganicGrit.com. It’s made with natural ingredients like bee wax and peppermint, avoiding harsh chemicals and NSAIDs.
All their products are verified by third-party labs, specifically SC lab in Denver, Colorado.

Also check out [The Science of CBD Topicals: Organic Grit CBD Salve for Deep Pain Relief](https://www.organicgrit.com/blogs/news/the-science-of-cbd-topicals-organic-grit-cbd-salve-for-deep-pain-relief?_pos=1&_psq=Salve+and+pain&_ss=e&_v=1.0)and [CBD and Arthritis: Easing Joint Pain and Improving Mobility](https://www.organicgrit.com/blogs/news/cbd-and-arthritis-easing-joint-pain-and-improving-mobility?_pos=1&_psq=Arth&_ss=e&_v=1.0)."
My anticipatory anxiety is hitting hard tonight,3,disability,"You might be able to ask your case worker at Social security or your insurance company if there are any resources that could help you, like you may be eligible for an in-home carer or help getting groceries delivered. I'd also like to say that I'm in the same boat. I'm 32 as well, mostly house bound & rely on my mom for housing & transportation. I know how isolating it all is & I'm sorry you're going through this."
"Disability-intolerant family member, how to handle?",44,disability,"Ugh, its a parent too? Been there done that... my father was certain that there was nothing wrong with me except that I was fat (I was 150lbs at 5'4""). He changed my diet and my exercise routine so strictly that my POTS and EDS and Narcolepsy all got so much worse. I also now struggle with my eating habits because of that time in my life. Funny thing is he just had his first bout with covid (I know, its insane esp considering he only got vaxxed once) but now he is showing symptoms of long covid and covid-resultant POTS and he refuses to go to a doctor or anything and he's just giving up. In a drunken ramble, he admitted to my mom (his ex-wife) that he thinks he may have cancer... it sucks big time. 

Im sorry, I know firsthand how hard it is to have a parent do that shit to you."
were my expectations of PT too high?,3,disability,"Pt should defo be better than that, I’d try to find a different person or a diff location if you can. The ones ive kept have listened. Had me do the exercises with them to make sure I have correct form and it didn’t hurt and would listen to what parts of it hurt me or not
Many PTs don't know how to work with hypermobility. Your experience is not uncommon but it shouldn't be standard. Hypermobility is a complex issues because building strength is super important but you need to limit stretching because the movements that feel natural aren't usually within a healthy range. My old PT was constantly telling me to make smaller movements. 

If you can find a PT in your area that is experienced with hypermobility, you are likely to have a better experience, but they are hard to find, I still haven't found one.
I have had similar experiences with physiotherapy, but also some good ones. Physiotherapy with a focus on pain management worked better for me than a focus on mobility. That's because it was almost impossible to do difficult but helpful exercises until I learnt to manage my pain more (although pain and mobility are connected). I also had the experience of being basically told ""stop doing that and move like a normal person"" like it had just never occurred to me to try?! But now its extremely obvious I can't do that. 

I don't understand their comment about range of movement. If you're hyperextending your knees, it sounds like your range of movement is *too much -* it can go the other way. 

General physiotherapists seem uniquely terrible at dealing with hypermobility, although its slowly changing. Don't give up!
Youre not exagerrating, hypermobility sucks. You need to find a PT who specifically knows a lot about hypermobility. Most don't have a clue about it. 


However even with a hypermobility informed PT, you likely will be expected to self-advocate, and the main focus will be exercises. Unfortunately we have to teach ourselves a lot and fight for ourselves


Try your best to figure out what your personal goals are (ex. more support with mobility day-to-day to increase function, self-care, etc, and preserve energy so you can actually do the exercises), and practice asking for help with them, and write questions up ahead of time. Also write down your limitations (ex. can't stand with your knees bent). The more prepared you are the better it goes. It sucks because it's a lot of effort and I wish theyd take more initiative, but they don't, so we have to :(


Good luck!
If you are interested in mobility aids, braces, etc, mention those specifically too"
"""fall risk"" question",56,disability,"If you have anemia that causes any sort of dizziness that’s gonna go under the fall risk category. If you’re inpatient in a hospital and have a known chronic illness with any mobility issues they’ll probably put you as a fall risk. 
What’s OI stand for
I was a nurse for 25+ years. 90% is a fall risk. Old, under 18, medications, mobility devices, medical conditions, history of falls, etc👌🏽
All patients have “ the right to fall and sue”. We have a right to cover our butts legally, everyone is clumsy and has blame in their fall.
that makes sense! in my case this was from a neurosurgeon consult & a referral for a full-body bone scan, but that might become relevant when i have a surgery at the end of this month that might affect my mobility during recovery
i didn't bring up mobility aids (which i use every once in a while) at the appointment where this was noted down (the photo is from my records), just the fact i fainted & fell"
[Rant] Endless cycle of getting worse because condition makes it harder to seek care,18,disability,"Exercise with a disability can be so mundane and frustrating. I have a gym membership but I do the lightest weights on every machine and even that’s hard. Are you able to save up to buy resistance bands? They are a much cheaper alternative than weights and honestly more suitable for people with disabilities imo. I also struggle with motivating to workout myself. It can be so demoralizing doing barley any exercise and just being exhausted and knowing you won’t get much stronger. But I try to tell myself it’s better to move your body a little rather than not all. It will further progress our weaknesses being stagnant. I hope you find some good workouts that work for you!
If you'd like to be more active without a gym membership I highly recommend Hybrid Calisthenics. He has a website and a youtube channel. On the site there are very easy variations of every exercise that are comparable to physical therapy. If you can't do a pushup for example there is a guideline for working up to a single pushup with wall pushups, then inclined pushups, etc. No equipment strictly necessary and there are suggestions for low cost set ups if you do want some equipment.

In the end though remember that it's okay to not be where you were before and to not push yourself past your limits to perform to abeled standards. Moving your body is good! But if you can never get to a full pushup or pull up ( I couldn't), doing the easier variations is still worth it to keep your joints healthy. Anything at all is better than nothing. If you're to the point where walking up the stairs or even sitting up from a chair is exercise, that is okay. 

Also second what the other commenter said about resistance bands! I was using the smaller ones and with some youtube walkthroughs you can get a really great workout in a tiny bedroom. Good luck!"
Lack of seating,28,disability,"Not that this is relevant or necessary information to justify my complaint, but yes, I have multiple mobility aids, and regardless, my disability is inconsistent and tumultuous.
I shall thank you to not make presumptions about my disabilities health and mobility aids. As I said in another comment, not that you need to know or is relevant to what I stated, my condition is inconsistent and I have multiple mobility aids."
"""You're on disability? Let me guess, depression and anxiety?""",945,disability,"👏🏼 👏🏼 👏🏼 Amen! Preach sister! 😁💜 
Jeez, doc, stop obsessing about my need for a wheelchair atrophy prevention PT routine and focus on how demoralizing it is spending 3 hours on the phone with Medicaid Transportation each week trying to book wheelchair van rides to my appointments! Can I just get the damn script for the as needed benzos already??!?😡

😂 

A #spoonie has a bracelet or a small wallet card to notify 911 of a disability. 
A #complexspoonie has a life alert button and 2 sided 8.5 x 11"" paper full of text explaining all 15 conditions/diseases they somehow live with.
I'm on disability for a rare incurable disease that has destroyed the mobility of my arms, hands, legs, and feet.

And I am neither depressed nor have anxiety.

I am the complete opposite, working hard every single day to have the best quality of life I can.

Perspective. It can change everything about life in a second.

Stay strong 💪
I hate you Had To go Through with that. Just tired of ignorant Ableist people sometimes 

Yeah Your Reasons For being on Disability is Valid 

Just Made me Also think about my personal experience with people like that 

Like it makes me Very Sad that Some people don't understand 

How Much Non Visible as well as Visible Disabilities effects people 

Well for me I have Severe Panic Disorder and Generalized Anxiety disorder 

And bipolar disorder and unspecified PTSD, And recently got diagnosed with a mild intellectual disability 

Just get tired Of The Abled body making disability like the Olympics 

Like people have to compete with each other to see if they Disabilities are severe enough for disability 

Which true definition of disability is something that effects your daily life or function 

Which this does 

Which I have Agoraphobia I'm the opposite I can't Be Around people 

I can't even go to the Hospital without having a panic attack 

like live alone but that doesn't make me fully independent 

Because I still can't keep a stable job and have friends and function 

Only time I leave my house is to shop and check mail which is difficult 

But I live alone don't really have support 

Since I look so Normal and functional unfortunately 

Plus people think because I'm a black man I'm immune to being disabled or having a disability 

Just kinda hard Because my disabilities is just as valid as anyone else that is in the community 

It effects me daily 

It's detrimental on my economic status 

It's hard to just text and talk on the phone 

Even right now I'm getting a headache 

But it's a lot of agoraphobic people that live alone that's my disability 

Try to explain to ignorant people that are Ableist like you dealt with 

I'm quite the opposite I can't stay with people I would have a panic attack unfortunately 

It's hard to just check in a hospital for a crisis 

Like they force you to share rooms which aggravates my disabilities.

And aggravates my anxiety PTSD symptoms as well 

Just everyones disability effects people differently 

Mines kinda severe to me 

Like Hate the Competition Thing abled body people created 

Sound like people have to compete with each other like freaking capitalism 

Just for Disability payments 

I hate that 

I wouldn't apply for disability if I didn't need it 

I felt so much guilt younger

People saying my disability is not severe because they can't see it 

Or people always assume you faking it 

Since mental illness they quote you can fake 

Which makes me very upset 

Because they will never know how I feel in my body and mind 

If only that knew they wouldn't be saying that 

And by the way Disability payments can't even cover Rent payments 

A 1 bedroom apartment in my area is over 1500$ for the worst area 

So probably pushing 2000$+ for a good area

Just make me upset and triggered 

Because I have no reason to make up how my disability effects my life daily 

People are so ignorant with mental illness 

They assume because I'm laughing at a movie 

Or taking a selfie 

I'm faking a mental illness 

Which makes me upset 

Like My therapist tells me to watch television using coping mechanisms to distract 

Like they don't know people with disabilities don't always have bad days 

Have a bunch of bad days 

Which I do but 

I like doing the coping mechanisms my therapist taught me 

Just make me cry a little 

Because Disabilities people can't understand what they can't see

Not trying to get emotional 

Just your post resonated with my life 

Bought up bad memories I guess 

Like people think because I workout 

Which is at home by the way 

I can't handle public commercial gyms by the way 

But people assume because I'm trying to use a coping mechanism 

To cope with my disability 

That means I'm faking it 

Or using reddit as a journal like now 

Which I'm anxious as well typing this 

Just people don't understand disabilities effect people differently 

Just Ableism in society 

Might not be to abled body person that has no problems leaving their house 

Or a person that doesn't feel like a lion is being chased after him for just talking or talking on a phone 

Like I live alone but my with my disability I couldn't live with people that would make my condition worse 

I had anxiety just living with family members 

Just because I live alone people think my mental health is not severe 

That really makes me upset 

Because Disabilities effects people differently 

Mines just as severe or life altering as anyone else 

Just because I live alone doesn't mean I'm independent 

I still can't keep a job and stuff 

I don't think being independent is until I can live a functioning life 

And people that have jobs still have disabilities 

Disability effects everyone differently 

I hate this grade scale stuff 

That Ableist people use to say you not deserving of help

Just Ableism sigh

Which I tell distant family and Ableist strangers on social media sites 

I don't have to live in a group home unfortunately 

Because my anxiety would get worse and turn to a crisis 

Just I really relate to your post op 

I guess I got triggered by you quoting Ableist people that said that to you 


But hate people feel like mental illness is not taking seriously 

Which I'm not physically disabled which I definitely respect and understand 

But speaking from a Ableist person perspective 

Like they think people with mental illness or other invisible disabilities 

Should not be considered for disability 

And they always say we lazy or faking because we lazy 

Which I would love to keep a stable job 

But capitalism doesn't value that capitalism values efficiency and profit 

And doesn't value disabled people fitting in 

Not trying to rant on capitalism because I know everyone opinions is different 

I would love to work it's just hard with my conditions

Because due to Ableism they really think People getting disability checks 

That doesn't even cover a full month of rent 

Is a luxury.

Which the Lowest paying minimum wage job pays more than disability pays people.

Like This effected me for a long time 

My whole life 

Just because it gets me emotional knowing because you don't see me walking in a cane or wheelchair 

Or a Down Syndrome or something more visible 

Like I don't have those conditions I'm still disabled as them 

Autism you can't see, learning disabilities you can't see

Even some physical illnesses are invisible 

Such as Sickle Cell and Lupus 

Everything is not visible like blindness 

But my mental illness effects my life as much as any other disability effects people lives in society 

Just because I have muscle or tall black and 6'2""

Keep myself groomed 

I guess I have to look unhoused to For people to understand how my disability effects me seriously 

It's so flawed 

Invisible Disabilities doesn't work like that unfortunately 

I'm deserving of disability as much as anyone that has a disability 

Sorry for the rant OP
Don't believe those negative claims. While your physical issues may still be unclear, both anxiety and depression are treatable. I come from a family with a genetic predisposition to depression, and four years ago, I struggled with severe anxiety and depression. However, after eight months of effort, I fully recovered—without using medication or psychotherapy.



If you take the time to learn more about healing anxiety and depression through nutrition and exercise, and stick to the process, you too can achieve a full recovery.
That is a beautiful dress!

I'm on disability for horrible ptsd, bipolar 1 and anxiety, unable to handle life as a ""real person"" and now I have physical conditions that are impossible to do anything much as my mobility is super impacted.
I use multi-disabled. I have vision, hearing, mobility, dexterity and psychiatric disabilities. But I think 2 is still ""multi"". :)"
‘Disabled’,45,disability,"Ayyy I'm also 19 with several disabilities.

My mom is a Gen-xer and she had to come to terms with me being disabled at the same time she realized her herself had been disabled all her life too with three conditions I also have and she never really realized it (like many folks with Autism, Ehlers-Danlos and Narcolepsy, we both kinda thought it was normal until I started having severe sleep issues and pain). 

In a way, I think I struggle more with my own limitations that my mom struggles with them. I try so so hard to do things I know I can't. And she is always the first to remind me that NO ONE can do everything, my limitations are just harder set and more visible than others'. But instead of busting my balls to do things that hurt me, I should spend my time getting really good at the shit I do well and then trade off my skills for the things I can't do.

 Perfect example -- I'm a good cook, but I can't stand in the kitchen long enough to cook AND do dishes (between the hot water and the standing, it drives my POTS crazy). I cook and manage the food budget for me and my two roomies, and they clean up. 

Another example, my boyfriend is a brilliant mathematician and chemist, and he is physically very strong; I am neither. However, he really struggles with executive functioning (we suspect, and are in the diagnostic process, for autism). He was also raised in a *less then supportive* environment and so he is terrified of doing anything that qualifies as ""adulting"". So I help him with job searches and setting up doctors' appointments (and sometimes with writing essays), while he does the laundry and helps me with my homework. And we can both cook, so we often bicker about who is stuck with the dishes :P

Life is already fuckin' hard enough. Fighting your limitations is the human experience TO A POINT, but not to where you put yourself in harm's way. And honestly, I'm doing pretty damn good, in a lot of ways because of the paths my disabilities have led me down; I've learned about medicine to help myself when I'm sick, now I'm studying for the MCAT. I study music because I could never do sports, and it's brought so many great people into my life. Find a balance and people who are willing to trade skillsets with you. That is so much more important than trying to push past ""false limitations"" that ableists think we put on ourselves (and yeah, I hate to say it, but its definitely a form of passive/internalized ableism).

Feel free to reach out if you ever want a buddy your age. I know, at least where I live, disabled folks our age are hard to come by, and that can be pretty isolating.
No problem, I only recently found out that it’s an official organization instead of just a general name for any disability focused sport"
"What do you do when both partners in a relationship are disabled, and you both need help, but you can't help each other?",25,disability,"Comparing is never good! That only causes problems. Do not listen to people saying that, only you can judge that. People on Reddit are quick to say things like that.

I hope you get good results from the MRI, maybe something that is fixable. Hopefully with physiotherapy maybe."
Looking for advice/ opinions on accessible martial arts,2,disability,"Most adaptive sports organizations began with someone just like you, wanting to something but not knowing where to start.

You should start by contacting people who are already in the adaptive martial arts community. Most are pretty helpful and eager to help grow the field. 

Sterling Chase of [DyMyon Martial Arts](https://www.dumyonmartialarts.org/home) is super friendly, and could help answer your questions about starting and running a program. National Governing Bodies in the sport, such as [USA Judo](https://www.usajudo.com/coach-club-resources), [USA Taekwondo](https://www.usatkd.org/), and [US Jiu-Jitsu Federation](https://www.usjjf.org/united-states-para-jiu-jitsu-reg-program.html) have resources to help you get started. 

Searching ""adaptive [martial arts discipline]"" may also yield existing programs in your area to explore. Once you're set up, [AbilitiesExpo ](https://www.abilities.com/) can help you as a venue for demonstrations and networking with local rehabilitation center employees."
"""Survival Jobs"" are not disability friendly.",192,disability,"I feel this. I can’t stand for basically any period of time without assistance (from mobility aids or walls/people) and I have massive brain fog issues. I also have an amnesia disorder so I have a really hard time remembering things. I can’t have a job where I need to stand (so most retail) or take orders and things. I worked retail for a while, but I had to call out a lot for pain or other chronically ill things. Luckily for that job they let me sit down, but I hated strict cashier days.

Before my disability got really bad, I used to be a teacher and I was forgetting things constantly, and when I asked for more time to get grading done (because I would literally forget it was there) they told me that no one else has a hard time so I just needed to buckle down and do it. This came from the same vice principal who asked me what having accommodations would do for me in the job 🙄 not to mention my chronic fatigue and insomnia would lead to me having micro naps sometimes, or the one time where I passed out in front of the students.

While I’m glad I don’t have to worry about that any more, some people act like I’m happy that my college degree is going to waste"
