pid,title,score,subreddit,comments
p0039,Mother is having trouble adjusting to life with low vision,16,Blind,"I lost a significant portion of my vision at 37 after a medical emergency.  Has your mom seen a low vision specialist?  If not, then she definitely should.  Mine hooked me up with all types of resources.  

Has she contacted her state's (assuming you are in the US) organization for the blind and visually impaired?  Our's is wonderful and offered Orientation and Mobility Training and assistance with training on and accessing assistive tech.

iOS and Android both offer a ton of accessibility features for the visually impaired.  However, there is a learning curve, and I think it is additionally frustrating if you over-rely on your remaining vision.  I learned a lot by looking up YouTube videos on Talkback for Android and I'm sure there are similar content available for iOS.

I can navigate (mostly) by sight in most situations by sight, but I do use a white cane in large crowds and in situations like when there might be a lot of stairs or terrain changes.  She could use one as what's called an ID cane which is not for navigation per se, but rather to communicate to others she is visually impaired.  

Finally, she should definitely seek mental health counseling.  With all she's been through, she probably needs it.  It took me a little over a year to fully process my vision loss and I'm still learning what the new normal is.  The things we do often we relearn quickly, but there's things pop up all the time and I'm like ""I can't do this the same way as I used to.""  It takes time to adjust.  Good luck and best wishes to for your mom."
p0040,My boyfriend has Retinitis Pigmentosa and I’m anxious about the future,14,Blind,"I'll keep this brief for now because I dobut it's the answer your looking for but:    
I've been married for ten years and an unemployed due not only to my blindness but other physical and mental health issues.    
Yet, we love one another so much that we've become insuperable over the years.  She works a fulltime job and I keep the house.  During the height of the U.S.  quarantine she worked at home for two months.  We had our ups and downs but when she was called back to work it was depressing for both of us -- overall,  we enjoyed the time we got to spend together at home.      


If your boyfriend's blindness does become severe enough that he can't work then there's several variables in the relationship that need to be addressed:     
1)  Can he be considered for disability which may offset some financial stresses?    
2)  Can you two still connect on an emotional/personal level even if he's blind or severely visually impaired?    
3) Does he have meaningful hobbies or secondary interest that could occupy his time if he cannot work?  This is important for him because otherwise he could become depressed and reclusive.    
4) Can you assist him/ or you willing to assist him in certain task?    
5) Are you or him willing to redefine not only your relationship but your future lifestyle together?    


Also, not to offend you at all,  but please keep his personal well being in mind and make sure he's not going to slip into a depressive or self-destructive funk.  It's important you both be honest and realistic but also open to change.     


Oftentimes, we have preconceived notions of what life and relationships and our futures should be but it's like that ol' addage:  If you wanna make god laugh -- make plans for the future.     


You've both got the journey of life before you  --  there is no right or wrong answer."
p0041,New glasses!,14,Blind,"Thank you, I've spent all day stressing about going out tonight and what it might mean for my future. I'm not so worried about me but about other peoples reactions. I've had drs blame some very obvious problems on my mental health before like I was told my continence issues were unrelated to the organ falling outside my body. I'm worrying this will be another thing they choose to build into something it's not. I'm doing all this while at the same time knowing that it might not even be an issue, maybe these glasses have done the trick. But hopefully by the time I tuck myself into bed tonight I'll have the experience/information I need to decide what I need to do going forward. I just want to feel safe and have a reference point of where I am being that a sliver of curb or a drain cover catching the light or that be a cane telling me where the edge of the path is. In myself I don't really care as long as I can still go out when I need to. It's the worrying about other people that's getting to me at this stage."
p0042,Going blind maybe. How to cope learn skills and handling emotional issues,14,Blind,"Not sure if you have other symptoms as well, but when I was tested for MS I was asked about double vision and eye issues. Hopefully it’s not that, but something to look into if your doctors haven’t already.

I have keratoconus and have had issues with my vision progressively degrading since my late teens. I was finally diagnosed in my late 20s and it was devastating knowing my eyes would continue to get worse as I aged and that I would likely need surgical procedures in the future. Up until I was able to start seeing doctors who understood the disease, eye exams always resulted in emotional breakdowns from frustration and a feeling of loss.

I highly recommend getting into therapy if you aren’t already. Talking about things coming up as you learn to cope and adjust can help. Finding online communities of people dealing with similar conditions also helped me. Look for groups that are helpful, constructive, and mostly positive. Venting is helpful and sometimes informative for others, but I’ve seen a lot of chronic pain groups devolve into competitive pity parties, “life is terrible” posts, and overwhelmingly depressing environments. If I notice anything like that, I move on for my own mental health.

As far as technology, I use larger computer screens at work and increase font sizes. I set the brightness and contrast so I can see better. I always make sure rooms I’m in regularly and can control have bright enough lighting since I have issues with seeing in the dark. I’ve mostly given up driving unless absolutely necessary, especially at night. What you need may be different, but there are settings and computer themes you can use to help better with your challenges.

I use blue light filters on my phone to remove blue light, especially at night, to avoid eye strain. Voice to text is a lifesaver at times. 

For eye health, I see my eye doctors for routine checks at least yearly to make sure the rest of my eye health is still good, since my mom found out she had glaucoma around my age. I also make sure to wear sunglasses when I’m outside for UV protection.

I hope you can figure out what is going on with your vision and wish you the best on your journey. I don’t know if any of this has been helpful with your condition, but I hope it’s given you some ideas and hope that you can get through it. Know you aren’t alone."
p0043,Recently diagnosed w/ RP,15,Blind,"hello! and welcome. I feel your pain. also 24 but I got diagnosed at 14. keep some hope. science is progressing to unfathomable levels. sci fi cant even cover it. 

as for mental health. grab a psychiatrist asap."
p0044,"It’s mental health awareness week in the UK and I made a video sharing my thoughts. I’m severely visually impaired and no stranger to mental health struggles. So, I hope this resonates with you, too.",14,Blind,"I also want to compliment your voice, it's very calm and nice to listen to! 

I am working in the mental health field and studying to become a therapist at the moment.  I really believe that in this time of loneliness having someone to talk to and openly, comfortably speaking about what's going on in your mind can go a very long way. But sometimes you just don't have such a person in your life at the current time, maybe you moved to a new city and barely know anyone. Or you started college and lost connection to most of your highschool friends.it can be hard to find that one person that you can open up to.

I don't think most of these people necessarily need a therapist, often a friend can help them just as much. But therapists are there to help you if you feel like you need someone, and it doesn't make you crazy or mentally ill. Unfortunately these are still existing stigmas arround therapy, especially in the Asian countries. It is not wrong to seek help if you need it, it's a sign of strength not weakness"
p0045,Dealing with paranoia while blind,11,Blind,"This is a tough one. I've got paranoia in large part because people do watch me when I'm out, they like seeing a blind person doing the thing. I think a big part of managing it is just knowing that you're prone to this kind of thinking and doing what you can within reason to be safe when you go out. Most people are not going to hurt you even if they are watching you, and it can be to your advantage that people are watching because if something does start to happen there are more witnesses to it. Keeping an eye on your mental health for the day is important too. I have days where I know I may not be able to go to some places because I'm just too keyed up. I do a lot of planning ahead too, but that's a general blind life thing; you kinda have to know where you're going and how you're going to get around at that place and then get home."
p0046,Seeking psychiatric help,13,Blind,"I've often said going blind is hard but being blind is easy.

Day to day life as a blind man has been way better than I expected but going through all the emotions and grieving that comes with the diagnosis was hell.

And nobody helped. Nobody explained the profound sense of loss I was about to experience. Nobody warned me how much it hurt to realize some of my dreams would never come true. Nobody told me about the jealousy and the anger and the depression in store.

All they told me was ""Call this number for a free white cane.""

It turns out most ophthalmologists don't understand the grief we go through. They aren't trained to deal with it and if we don't bring it up they don't bring it up, either.

It's a little messed up, isn't it? We're handed a life changing diagnosis and just assumed to take it in stride.

The truth is I'd be more worried about someone who didn't have a gut wrenching emotional reaction to learning they're going blind. Anybody who can lose their job and their driver's license and their hope for the future and NOT need a therapist to discuss the turning of their world upside down is scary.

Mental health counseling should be part of the diagnosis. It's unreasonable to expect us to not get messed up when we hear it. But it's not. We have to bring it up to our eye doctors to get a referral or we have to find a therapist ourselves.

I guess this is my way of saying I sympathize, I get it, and you're not alone.

There are counselors who specialize in disabilities and in grief. Hopefully someone in this thread recommends a good one in South Carolina to you,

In the meantime my DMs are always open and I'll link you to the blog posts where I write about figuring my own way through the grief and loss.
Others have addressed things well I just wanted to mention that you may be experiencing Charles Bonette Syndrome, a form of hallucinations created by the eye itself when vision is changing. It was first noticed in cataract patients but it can happen to anyone with enough vision loss. I have it and it took two retinal specialists to tell me what it was; it flares up worse when I'm sick or stressed. If the things you're seeing in the periphery of your vision are consistent, always in the same spot, and it's been going on for awhile, it may be Charles Bonett Syndrome, which isn't dangerous but it is annoying as hell heh. 

And I second what's been said elsewhere here. Going blind sucks hardcore, being blind isn't so bad once you get used to it. I think you may be eligible now for services like Medicaid and Social Security Income and if you can get on any of those you may have better help finding some mental health coverage.
It don’t have practical advice about your mental health question, except to say that I’ve found brief counseling sessions very helpful. With the state of our health care system, I think anyone seeking medical treatment would benefit from counseling support. Maybe look into a teledoc as a first step, if you have access.

I wanted to mention, though, that what you describe sounds somewhat like the visual aura that can accompany migraine in a couple of key ways:
- Visual aura often begin with the peripheral vision, and can be accompanied by other peripheral effects like tunnel vision.
- Mine typically progress to what I can only describe as flashy light worms that dance around my central vision.
- It’s fairly common for migraine sufferers to wake up with the symptoms. They can also be triggered by the whole long list of migraine triggers, from smells & foods to hormonal shifts, sleep deprivation, or stress.
- They aren’t always accompanied by migraine pain. I had weird (& upsetting) aural symptoms for a few years before ever experiencing my first migraine headache. They did, however, respond to migraine medication or sleep.

The Wikipedia article on Scintillating Scotoma has some reasonable artistic renderings of what they look like, although none of them are exactly what I see. Check it out and see if they look familiar: https://en.wikipedia.org/wiki/Scintillating_scotoma"
p0047,"Looking for support, been visually impaired & a braille reader all my life, used to have some usable sight, lost everything several years ago and still struggling with living in total darkness.",13,Blind,"I was lucky enough to find a great mental health counselor that helped me reinforce using my tools to cope wit vision loss, have you ever tried it?"
p0048,Toxicity in the blind community,12,Blind,"My personal policy, to preserve mental health, is blind friends online, sighted friends offline.  There are a lot of really wonderful blindness communities online, like this one.  However, as soon as you bring these communities into the ""real world"", you get nothing but drama.  Plus, the fact that most sighted folks post nothing but images online these days means that interacting with them over the internet is not rewarding.  So I'd rather spend the time strengthening my sighted friendships offline.  "
p0049,"""You're on disability? Let me guess, depression and anxiety?""",928,disability,"Oh totally - I use a chair, am losing my hearing, but the mental health issues, especially SI are by far the worst bit. Hope you find some peace.
You look so lovely! love your dress, it suits you perfectly!

And thank you for helping me feel validated and less like a fraud. I’m on disability for multiple mental health reasons and sometimes o feel like my family, friends, and doctors look down on me for it but my therapist has been helping me combat that. Mental health issues can be debilitating and dangerous, I’m glad it’s a valid reason for disability even if it’s a hard battle to be approved.
I’m on disability for mental health reasons (panic disorder with agoraphobia). I just wanted to thank you for posting this. Mental health struggles are no less valid or debilitating. It makes me feel a bit less depressed to know that others (like yourself) understand.
Right! Like, I'm disabled for mental health reasons (ive been on it since i was 8) and its not like i just get a little sad and anxious sometimes. i have severe breakdowns when im under any sort of stress to the point that i could not work a full time job, even though i really wish i could!
I hate you Had To go Through with that. Just tired of ignorant Ableist people sometimes 

Yeah Your Reasons For being on Disability is Valid 

Just Made me Also think about my personal experience with people like that 

Like it makes me Very Sad that Some people don't understand 

How Much Non Visible as well as Visible Disabilities effects people 

Well for me I have Severe Panic Disorder and Generalized Anxiety disorder 

And bipolar disorder and unspecified PTSD, And recently got diagnosed with a mild intellectual disability 

Just get tired Of The Abled body making disability like the Olympics 

Like people have to compete with each other to see if they Disabilities are severe enough for disability 

Which true definition of disability is something that effects your daily life or function 

Which this does 

Which I have Agoraphobia I'm the opposite I can't Be Around people 

I can't even go to the Hospital without having a panic attack 

like live alone but that doesn't make me fully independent 

Because I still can't keep a stable job and have friends and function 

Only time I leave my house is to shop and check mail which is difficult 

But I live alone don't really have support 

Since I look so Normal and functional unfortunately 

Plus people think because I'm a black man I'm immune to being disabled or having a disability 

Just kinda hard Because my disabilities is just as valid as anyone else that is in the community 

It effects me daily 

It's detrimental on my economic status 

It's hard to just text and talk on the phone 

Even right now I'm getting a headache 

But it's a lot of agoraphobic people that live alone that's my disability 

Try to explain to ignorant people that are Ableist like you dealt with 

I'm quite the opposite I can't stay with people I would have a panic attack unfortunately 

It's hard to just check in a hospital for a crisis 

Like they force you to share rooms which aggravates my disabilities.

And aggravates my anxiety PTSD symptoms as well 

Just everyones disability effects people differently 

Mines kinda severe to me 

Like Hate the Competition Thing abled body people created 

Sound like people have to compete with each other like freaking capitalism 

Just for Disability payments 

I hate that 

I wouldn't apply for disability if I didn't need it 

I felt so much guilt younger

People saying my disability is not severe because they can't see it 

Or people always assume you faking it 

Since mental illness they quote you can fake 

Which makes me very upset 

Because they will never know how I feel in my body and mind 

If only that knew they wouldn't be saying that 

And by the way Disability payments can't even cover Rent payments 

A 1 bedroom apartment in my area is over 1500$ for the worst area 

So probably pushing 2000$+ for a good area

Just make me upset and triggered 

Because I have no reason to make up how my disability effects my life daily 

People are so ignorant with mental illness 

They assume because I'm laughing at a movie 

Or taking a selfie 

I'm faking a mental illness 

Which makes me upset 

Like My therapist tells me to watch television using coping mechanisms to distract 

Like they don't know people with disabilities don't always have bad days 

Have a bunch of bad days 

Which I do but 

I like doing the coping mechanisms my therapist taught me 

Just make me cry a little 

Because Disabilities people can't understand what they can't see

Not trying to get emotional 

Just your post resonated with my life 

Bought up bad memories I guess 

Like people think because I workout 

Which is at home by the way 

I can't handle public commercial gyms by the way 

But people assume because I'm trying to use a coping mechanism 

To cope with my disability 

That means I'm faking it 

Or using reddit as a journal like now 

Which I'm anxious as well typing this 

Just people don't understand disabilities effect people differently 

Just Ableism in society 

Might not be to abled body person that has no problems leaving their house 

Or a person that doesn't feel like a lion is being chased after him for just talking or talking on a phone 

Like I live alone but my with my disability I couldn't live with people that would make my condition worse 

I had anxiety just living with family members 

Just because I live alone people think my mental health is not severe 

That really makes me upset 

Because Disabilities effects people differently 

Mines just as severe or life altering as anyone else 

Just because I live alone doesn't mean I'm independent 

I still can't keep a job and stuff 

I don't think being independent is until I can live a functioning life 

And people that have jobs still have disabilities 

Disability effects everyone differently 

I hate this grade scale stuff 

That Ableist people use to say you not deserving of help

Just Ableism sigh

Which I tell distant family and Ableist strangers on social media sites 

I don't have to live in a group home unfortunately 

Because my anxiety would get worse and turn to a crisis 

Just I really relate to your post op 

I guess I got triggered by you quoting Ableist people that said that to you 


But hate people feel like mental illness is not taking seriously 

Which I'm not physically disabled which I definitely respect and understand 

But speaking from a Ableist person perspective 

Like they think people with mental illness or other invisible disabilities 

Should not be considered for disability 

And they always say we lazy or faking because we lazy 

Which I would love to keep a stable job 

But capitalism doesn't value that capitalism values efficiency and profit 

And doesn't value disabled people fitting in 

Not trying to rant on capitalism because I know everyone opinions is different 

I would love to work it's just hard with my conditions

Because due to Ableism they really think People getting disability checks 

That doesn't even cover a full month of rent 

Is a luxury.

Which the Lowest paying minimum wage job pays more than disability pays people.

Like This effected me for a long time 

My whole life 

Just because it gets me emotional knowing because you don't see me walking in a cane or wheelchair 

Or a Down Syndrome or something more visible 

Like I don't have those conditions I'm still disabled as them 

Autism you can't see, learning disabilities you can't see

Even some physical illnesses are invisible 

Such as Sickle Cell and Lupus 

Everything is not visible like blindness 

But my mental illness effects my life as much as any other disability effects people lives in society 

Just because I have muscle or tall black and 6'2""

Keep myself groomed 

I guess I have to look unhoused to For people to understand how my disability effects me seriously 

It's so flawed 

Invisible Disabilities doesn't work like that unfortunately 

I'm deserving of disability as much as anyone that has a disability 

Sorry for the rant OP
Absolutely. I'm tired of the nonsense that mental health disabilities are less disabling or acceptable than physical.
Is it typically easier to get on disability via mental health or physical ?"
