pid,title,score,subreddit,comments
p0059,Discourse? ADHD as disability ,222,disability,"You're wrong about one assumption, and that's the assumption that ADHD is a mental health disorder. It's not. It's a developmental disability that's also neurological. And physically disabling someone isn't the only way to disable someone. 

Combined type ADHD is typically the type that makes someone unable to work and require disability, but the other two types can do this as well. ADHD impacts basic functioning and can prevent you from doing tasks. ADHD causes ""time blindness,"" which is when someone can't feel the passage of time. Two hours could pass, but the person with time blindness would think that only 15 minutes had passed, so ADHD literally takes away our sense of time. There's also ADHD Paralysis, where the body is paralyzed and can't move because the brain is too overwhelmed with stress, the environment (a messy room, for example), or exhaustion. 

ADHD takes over the entire brain and body. It makes life harder and puts those of us with it at a disadvantage. That's honestly just a few reasons why it's a disability. 

I have Ehlers-Danlos Syndrome, Congenital Heart Disease, Autism, and other physical and mental disabilities but my ADHD is still one that I struggle with the most even though it was my first diagnosis. 

I hope that helped.
Diagnosed with ADHD last year, DID last year, and bipolar 2 the year before. My ADHD was the last thing to be diagnosed to treated and being on medication has changed it from disabling my life to being manageable. There are a lot of factors. It was making treatment or commitment to any of my other mental health issues impossible. 

Some people may have “mild” ADHD and not consider it disabling. When I can’t get up to go to the bathroom, get to a therapy appointment, or take my meds because of executive dysfunction it impacts my entire body/life. My focus used to be all over the place and I’d fall asleep constantly. 

So I think compounded with any other mental health issues or physical health issues then yeah it makes a persons disabled.
Technically, I guess that's right. Sometimes it's used often incorrectly as an umbrella term for learning disabilities though a lot of times it seems to fit. I have a strong diagnosed case of it myself, but I never considered it a disability in of itself. There are several ways to work with it (at least in my case), but I can see where some people will struggle no matter the method used. If nothing else, I have empathy with genuine cases, but it makes me cringe when people casually blame their imaginary ADHD for a rare small mistake or minor lapse in attention. Like, ""Oops, I forgot my laptop for the first time in 6 years, must be the ol' ADHD kicking in, hyuck, hyuck!"" Now I know this can differ immensely, but my experience goes something like this:

-Wake up, take my Adderall, clean myself.
-Spend too much time in the shower thinking about all the things I need to do before coming to my senses and moving on to getting dressed.
-Spend a full 5 minutes staring at my bottle of stimulants, which I've set upside down as an indicator that I did take them, to try to recall if I took them or forgot to flip the bottle right side up the night before.
-Repeat the phrase ""wallet, phone, keys, and vape"" while patting down my jacket.
-Turn my attention to the pot of coffee I forgot I made, fill my Thermos.
-Jacket on, walk to the door; freeze.
-Turn around, grab my lunch from the fridge, back to the door; freeze.
-Repeat the phrase ""wallet, phone, keys, and vape"" while patting down my jacket.
-Turn around, track down my keys... and my debit card that I just remembered I took out of my wallet last night to impulse buy something that caught my interest.
-Finally, out the door unless I see my reflection in the window as if to remind me my hair is way too messy for the office. Grab a hat, then fix it during break later.
-Walk to work, enjoy the fresh air of freedom for 10 minutes.
-Reach the door to my workplace, have a small moment of dread while frantically feeling for my security tag. Feel relief if found or like you your whole day is ruined if not.
-Reach my cubical, no one but me there and the lights are off; silent, peaceful, and the best part of my shift.
-Begin my work routine (which I've written with a timed itinerary and pinned to my wall).
-Realize how far behind I am when coworkers file in. Notice our daily webcam Teams meeting is in 5 minutes.
-Work during the meeting to catch up, retain about half the information. Meeting ran long, factory floor walkthrough with dept. heads starts in 2 minutes and I have to use the restroom. Go as quickly as possible without seeming frantic. Say an awkward ""good morning"" to any coworkers I happen to see on the way.
-I have 1 minute, shove my messy hair into a hairnet and pack it down to look decent. Head downstairs, check to see if my fly is open along the way.
-Walkthrough runs a bit long, but that's fine until my supervisor needs to ask me a few questions. He's about a minute from his next meeting and still chatting with me like a psychopath. My blood pressure goes up on his behalf, but I joy down a few notes of the minor tasks he's given me.
-It's 9AM and the Adderall is finally kicking in. Time to accomplish something of value. I work straight through lunch, I'm not even hungry due to the side effects, keep working. The only limiting factor is how long it takes to respond to my voicemails and emails.
-Recall that I had some minor tasks to complete, have to run downstairs to grab the note that lists them that I left behind. I have 1-2 hours to complete. Finish quick, go home at 3PM.
-Run back to work because I forgot my phone or something important that I put in a drawer early in the day (once or twice a week).

That's just my professional life, but obviously some days are better than others and ADHD can vary widely in severity. I wouldn't discount it as a disability, still, people seem to think I'm forgetful, quirky, a fast worker, and (ironically) laser focused all at once.
Disclaimer: *I don't have ADHD, but I do have mental health disorders that contribute to my disability*

In my opinion, I really think the term ""disability"" should be used as liberally as people would like. If they feel they are disabled, then they're disabled. I think gatekeeping the term really isn't helpful for disability rights (1) , and can cause a lot of unintentional harm (2). 

1) Obviously there's a spectrum of disability, and there can be concerns about including those who have ""less severe"" conditions as disabled. My response to that is that that's always been the case, and that that rhetoric is often used to reinforce systems of ableism. (For example, mental health disorders, other invisible disabilities being included as disabilities) Labelling yourself as disabled is such a personal thing based on your own experiences with the world around you, and I think denying someone that is really counterproductive to promoting a less ableist society. 

(Also, I think the world is so ableist and the term ""disabled"" carries so much stigma, that if there really are any """"non disabled"""" people using the term when they shouldn't, they'll be quickly weeded out)

2) I can't begin to tell you the number of people (myself included) who I've met/heard of be terrified of using the term ""disabled"" because they don't feel their condition is ""bad enough"". (Especially people who don't have stereotypical/visible disabilities) For me, the term was liberating and validating and invaluable in getting the help I need. Not using the term meant years in delayed treatment and care that I could have been using sooner. I just wouldn't want to deny anyone else that experience.
How is adhd by itself not a primary mental health disorder it's literally a mental health disorder
Context is important. Untreated ADHD in an educational or workplace setting can be a huge barrier and have a major impact on your life and wellbeing. 

Unfortunately, we have a culture of competitive victimhood online, which inspires people to latch onto any identity based excuse for their behavior or choices and then wield that identity against any critique, valid or not. That seems to be what this initial tweet was reacting to."
p0060,Laughable ableism on Reddit,218,disability,"Just for clarification, is there a difference between excluding disabled and mentally ill from your consideration for dating or dating pool just because they are disabled versus knowing your needs and capabilities and that you can't manage certain challenges that come with certain conditions one has (like you won't consider being with someone who has bipolar disorder or schizophrenia because you'll feel unsafe with their instability, and you know you will have a better quality of life and have your needs met, it's what is best for you given your circumstances, and you connect better with someone who has minor mental health conditions or none at all also this is very important to you because most of your life, you didn't have the freedom to do what is best for you)?
I don't want to date someone who doesn't have coping mechanisms for their disability/mental health conditions and I don't think it's fair to do the same to others
After being in a relationship with someone with severe mental illness who physically abused me and my pets, I have a hard line now when it comes to mental illness. But only those with cluster B personality disorders who show they have a propensity for abuse. 

My mental health isn't stellar either so I know no one is perfect. I have clinical depression, ADHD, autism, and now PTSD. I've also come to the conclusion that my conditions probably make me more vulnerable to predators and it's important to learn how to protect myself from them. 
 
After what I've been through, I'm not sure if I'm being ableist. I'd like to think that I'm not, I'm just protecting myself. I guess it's a blurry line into ableism for me. 

I do find ableism abhorrent though and those who display it are to be avoided.
I don't think that's ableist at all. I think it's just a lot of awareness about the limitations your own disability creates- you know what you can and cannot offer. I have physical disabilities due to chronic pain disorders, so I could never be in a Shane & Hannah Burcaw kind of relationship. It's not that I wouldn't WANT to date someone with SMA, but I would be physically unable to provide care to them. I think you're saying something similar- it's not that you wouldn't WANT to date someone with a mental health condition, but you can't offer the support someone with similar symptoms to you would need. That's totally valid.
I also don't think it's fair to get into a relationship while knowing you're struggling with your mental health as it's a lot for the other person. I've been on the receiving end of it twice and it's horrid to be shut out because of that"
p0061,how do you stop grieving who you could've been if not for disabilities?,215,disability,"I acquired my physical and mental health conditions in my teens and 20s and it was hard knowing my life would be more limited than most. I'm 31 now can I can't say I don't grieve for who I might have been from time to time.

I think it is very much a grieving process. I found looking at advice on losing a loved one helped. Obvs it's not the same but there's still the same sort of emotions to work through.

I battled a lot in my head in my 20s I had nearly made it. I had gotten a job I loved and although financial things were not great I felt I was finally on the way up. A year later I'd been in hospital so long I'd lost my home and didn't even have enough to buy a drink in my bank account let alone public transport to my home town. Life had really reached rock bottom. But that experience taught me something. Relationships, friendships and the interactions we have with others and the world around us are so valuable.

Although several years on I have a stable living situation I still can't do the job I loved and as I couldn't get home I ended up living in a different area away from much of my support network at the time. Since then I've started to build my life back up. I have friends who really care about me and still see some of my family. That's what matters the most to me.

Life didn't take me the way I expected and while things are likely harder I've still been able to find a few really good people to have around me and I'm getting by. My future looked rubbish when I just looked at the practical stuff like being independent and working but I forgot that there's so much more to being human than working my backside off for someone else. Plus there's people in my life who I can just sit next to. The simple act of being in their presence improves their quality of life just because they like being with me, sounds a bit mad when you think about it like that. They might do practical things for me but that makes them feel good about themselves and they get to have a bit of a giggle at my sense of humour while we are at it - I'm by no means a comedian but do like finding the funny side to stuff.
I'm 30 and have several of the conditions you do, though I wasn't diagnosed until recently. I have ADHD, GAD, HEDS, POTS, probably CPTSD, plus some other stuff with my heart and eyes. 

Like you, I also didn't graduate high school due to mental health, and I went on disability assistance right at 18. I didn't get a job until 23. 

Unfortunately, stress is only going to make everything worse, which I know in the position you are in now feels impossible to stop. My best recommendation is to really focus all you can on your health. Look for every option, insist you need it and don't wait until you feel at your worst before taking action. The sooner you can start treatment for all of these things, the better your outcome will be. 

since i wasn't diagnosed with ADHD or HEDS until i was 27/29, i spent a lot of my early 20s trying anxiety treatment after anxiety treatment, not knowing why it never made me feel much better. The moment I was treated for my ADHD I was able to get my GED and graduate from university in two years. Now that I know I have HEDS, i can better understand my limitations and work around them while also doing what i can to make sure i don't get worse(tho this is still pretty new for me)

There is a story in Greek mythology about Odysseus Needing to sail his crew past some sirens. Knowing their weakness to the creatures, he had himself and his men tie themselves to the boat as they drifted past, rather than just assuming, through force if will, they would resist them. Thanks to their preparation, they survived the encounter. 

This is just like having a disability. We have limitations and can't just walk right into situations that non disabled people can. We can, however, get to the same outcome as everyone else. We just have to do some work beforehand. This requires us to acknowledge our limits so that we can prepare for them. Odysseus was no less of a hero for acknowledging their weakness and finding a way around, and the same goes for us disabled people. 

I'm saying all this because you are young and have a lot of time to plan your strategy around what challenges you may have. It might feel like you're falling behind, but in reality, lots of people have needed to wait and prepare before jumping into their adult life. And even more rush in and end up needing to learn the same lessons later in life. It took me until my late 20s and I'm super happy now! Sure, I still live with the issues I did before, but I now have the tools to manage them.

I hope some if this helps. I know exactly what it feels like to be loosing hope and even how scary it feels to accept that there might be hope. You can 100% live a happy life despite all that seems in your way.

edit: I want to add that I don't mean by this we should be able to do everything or that we all have equal access to all resources or that this stuff is really easy. I mean that, if the end goal is happiness, accepting that we cant do some things can be the preparation we sometimes need to make in order to get there. It's OK to grieve those lost options, but don't let grief cover up other paths you can take. I have grieved who I could have been with better support, but dwelling on that doesn't really help. We live in the now, and who we are now definitely deserves our love and attention ❤️

another edit: please feel free to message me if you have any questions! I'd be happy to offer some kind of advice or point you in some directions for help.
Personally, I don't you ever stop completely grieving for what could have been. 

BUT I think what's helped me the most is one simple prayer.

 God grant me the serenity to accept the things I cannot change, the strength to change the things I can, and the wisdom to know the difference. 

I don't consider myself religious and also learned that this is basically a philosophy called Stoicism. ""Stoicism teaches us to focus on the things we can control—our thoughts, emotions, and actions—while accepting the things we cannot, such as the actions of others or the natural course of events going on in the world around us.""

We can't change our physical or mental illness, accept it and let that burden go. We can change how we react to our situation by learning ways to cope: meditation, yoga, hobbies, spending time with friends and family, medication, exercise, eating well, therapy ect. You just have to find what works for you.

 Like you I craft, it's my therapy and can even be a meditation of sorts. Focus on what you CAN do and let go of what you can't do. You're 18, you're perfect just the way you are right now. Who you can be still has endless possibilities. 

Lastly I highly recommend considering cognitive therapy if it's possible, because it's your thoughts that are draining you and causing your mental health to decline. 

If you ever want to talk feel free to message me."
p0062,"""Disabilities only exist because of society"" is an ignorant statement made to cope with internalized ableism imo",206,disability,"I consider the terms 'condition', 'impairment, and 'disability to be very different.  As an advocate for Accessibility and Accommodation in the workplace, I help the members of my grassroots community to speak with the policymakers and ensure their concerns are heard. I am not always confident that progress will happen, but we persevere.
Depends on the disability. 

Personally, my adhd is something where the problems I face are largely societal. I don’t want a “cure” for myself because I honestly don’t want to be NT. The best thing would be to build systems which are more inclusive. I’m lucky enough to be in a field and in a workplace which suits me well and can capitalize on that difference. 

But my chronic pain and joint injuries are not disabilities because of society. They’re miserable because I’m in pain and I can’t sleep or function when they’re acting up. Yeah they’re way worse because societal factors have frequently made them worse by forcing me to use my limbs and increase my pain anyway, but I’ve been working to cure them for years. 

I’m the middle I’ve got allergies to fragrances (including vapes) and weed. That makes lots of situations around other people potentially deadly. If we as a society didn’t think creating a cloud of fragrance or smoke around you in public spaces was acceptable since it gets into other peoples bodies in potentially harmful ways, I wouldn’t have this issue. But so many people are allergic to different things that I accept eliminating everything that releases compounds into the air is not a reasonable ask. A few hundred years ago, I’d be able to breathe just fine so it’s technically created by society, and many of the issues I face are because of the way different situations are designed. So I need more thought out into how we design airflow in different spaces, but won’t go so far as to claim that my disability there is only based on how disability is treated.
Yeah, the aspie supremacists are quite cringe. Nothing is wrong with feeling empowered by your disability, the problem comes when you try and take it to the point of claiming that autism is a superpower.

I can totally understand how this reactionary ideology came about as a reaction to the demonization of autism by groups like Autism $peaks, but it is basically fighting fire with fire.

Saying ""autism isn't a disability"", is often said by people who forget entire segments of the autistic community that are definitely disabled by having autism. It's cool you're aspie and all but that doesn't mean there aren't people with higher support needs than you. That's basically what I would say to them.

It's also worth noting that aspie supremacy is also anti-disability pride, because aspie supremacy and declaring them to be not disabled is an attempt to distance themselves from the concept of disability. And that is something I simply refuse to accept. Aspie supremacists can do whatever they want... Over there... While the rest of us maintain disability solidarity and the idea that we need unity to stand together.

Neurodiversity is interesting because in a way it is a separate movement but it is alongside disability rights just with the addition of all mental health not just disabilities. Aspie supremacists try and claim the Neurodiversity movement for themselves occasionally but I oppose this strongly because solidarity is more important than *being right all the time.* If we have disagreements or different perspectives, we discuss them cleanly and productivity, we should never ever fight another comrade who believes in solidarity.

As we move forward and we start becoming more organised... We need to remember, what makes us strong is our differences, our experiences are all different, and we have so many unique perspectives. We would be a swiss army knife of an active movement. I hope one day we will be recognised alongside LGBT pride and other large movements. Because if we don't, we won't see the world we want to create.
* condition: we all have them. Nature of life, biodiversity and neurodiversity.
* impairment: if a condition cannot be treated and it leads to limitations in function.
* disability: when a condition or impairment reaches a barrier in home, society, workplace, and it prevents access to services, opportunity, and equity. The barrier in question is often there because of poor design or thoughtlessness of the functional authorities.

These are my definitions for them.

My autism is an impairment in some regards, but I do not consider it a disability (to me).

I am a disability advocate that helps push my policymakers to work better."
p0063,Ableist Garbage,195,disability,"Oh, I know all about the struggle to find good mental healthcare. And, I think we all always feel that way. Keep your head up, you got this!"
p0064,Wife denied for Mental health claim stating her Social Media presence showed her being happy.,195,disability,"Prudential was pretty clear that they don't see psych disorders as permanent disabilities when I went thru the process with them. Thank goodness that my psych diagnosis didn't enter my claim. I'm sorry to see that things haven't changed.

In general people don't understand how severe mental illness works. You can get bursts of happiness and still be depressed. Also, most people smile in photos in modern times because it's socially expected. Mental health tends to fluctuate over time. Mental illness can cause cognitive & executive function deficits.
We understand that it's not a permanent disability that the pay for, but there is a clause which they will compensate for mental health.
That's interesting. The absolute best thing I ever did for my mental health was getting off social media. No FB, IG, etc.  I decided my real friends deserved actual phone calls and text messages.  I also eventually got off every psych med too. Which made me feel human again.  But, we all have different needs.
Also, I was off work for 2 years and received payment first from my job for 6 months and then from my insurance. I was also able to travel and do any activity that would be helpful for my mental health. So no, I couldn't be outside because then I'm not really sick bs. Being happy and being on the beach is obviously no sign of mental stability. That sounds very absurd what you claim even when it is the US.
It's not worth it because the LTD calls for mental health is only one year of coverage.
My LTD was denied when I was working in banking. I was told that there’s no way to prove a mental health disability, and that literally, it was all in my head."
