pid,title,score,subreddit,comments
p0083,"I don't want my disabled ex to be homeless, but I need them to move out. ",111,disability,"Group Home. Try your local mental health agencies. They may have emergency housing.
I Was In Your Ex Situation Unfortunately. I definitely Understand that Especially Financially and Emotionally 

As Taking care of a Disabled Person is Very Mentally Draining 

And Society is Individualistic and Ableist so it makes it no better 

I Tried to help my situation. I reached out to every organization for help

I have Invisible Disabilities as well so people can't see it so therefore I look abled bodied 

I worked jobs Lifting 300lbs 400lbs barrels of water and fruit and vegetables 

Crowded job had panic attacks blurred vision lightheadedness and dizziness 

Everyday at the jobs

Till the fact my body couldn't handle feeling like that everyday 

Plus it was messing with my mental health 

I felt like a burden on family for a issue I didn't ask to have.

Like I understand people Houses and if I can't keep a job 

Which I couldn't I tried but always quitted 

So I got kicked out a lot by family and friends of the family 

Which I understand and stuff 

Really Don't Agree With The ""Learned Helplessness"" thing 

I understand it has some valid points 

But I just personally feel like it's a Individualistic approach or judgement 

To someone that is trying to get their situation atleast for my situation 

I was trying to work jobs getting headaches and Panic attacks just being on the phone 

And I worked a lot of public open jobs 

Which I wished people seem my disabilities so they wouldn't call me lazy or such

Or say things like ""Learned Helplessness"" and stuff 

Because I actually was trying to help myself 

Just I can't control the Disability process 

I can't put a gun to nobody head and say approve me for disability in less than a year 

Or tell a job to get me accomodations that actually benefits me and not the business 

It's so easy to go to Jail than actually trying survive in society

But I understand my Family and friends kicking me out 

Wasn't anything personal it's capitalism 

If I can't bring in a profit or benefit individually to a household or someone life.

I'm a burden and I understand that. Can't Force nobody to help you 

And I understand people mental health just taking someone else in 

Or caring for a disabled person 

Even though I didn't ask to have a disability 

But if it's making you comfortable evict them don't feel guilty 

I understand taking care of people with a disability or just anyone is difficult as well 

Atleast for me I didn't get evicted like that 

Atleast in the black community we don't do all that legal stuff 

They just put a Gun out on you or make physical threats to you 

From my experience 

I left the same day 

Remember my uncle making a threat 

That ""My Shit Better be in the Garage By Saturday"" it was a Thursday that week in 2018

Had to Leave unfortunately 

Which I did plus living with people that doesn't want you there 

Is very mentally draining 

I was scared to leave my room

Because I got threats violent threats 

Because I couldn't keep a job 

Just Disability takes years for people 

Especially non invisible disabilities 

So it took years 

I was seeing my Mental health workers 

Which I was in Georgia so I didn't have insurance 

So they kept supplying me with the same medicine that didn't work 

And I couldn't afford to get the new medicine my doctor prescribed 

I understand you have to do what's best for you 

I know I was trying 

Like I felt like I was a burden and unaliving myself at. That time 

Because I didn't want to be a burden 

I hate being a burden on people 

That's why I'm scared to get in relationships with women 

Because my disability is something I'm trying to figure out 

But I didn't ask for this

Feel like Eugenicists want me dead 

Not trying to trigger anyone 

Just your ex situation sounds like my situation 

But you have to do what's best for your mental health 

I didn't take it personal.

Even though it was family members 

That I couldn't reach out to 

Disabilities in my life is just hard 

Just people don't realize saying Learned Helplessness 

They don't realize it's not too much help as you think 

And plus it's a very huge waiting list 

Sometimes years long

Just getting help is not immediate

Just not enough resources 

Especially for a person like me that couldn't keep a stable job 

Which I felt bad I couldn't 

But people wasn't in my body they couldn't see how I was feeling 

Not trying to trigger anyone
At the end of the day, it isn't your responsibility.  They need to make an effort to either get a job or file for SS disability, section 8, food stamps, Medicaid, and find housing.  You didn't indicate what the disability is.  Are you actually caregiving, like feeding, bathing, etc, or just financial?  You're not family.  Even if you were, it's not worth sacrificing your mental health for this.  It sounds like you have your own family in the home as well.  So they're dealing with this as well?

It's very easy for someone with ""learned helplessness"" to give up and just rely on someone else.  My VA therapist introduced me to that term.  It sounds like your ex is experiencing this.  

""In psychology, learned helplessness is a state that occurs after a person has experienced a stressful situation repeatedly. They believe that they are unable to control or change the situation, so they do not try, even when opportunities for change are available."""
p0084,Can we talk about how friends and family leave us because of our disability(ies)?,112,disability,"As someone on the other side, thank you.

I had dated my boyfriend for 10 months when he suddenly had a stroke.
It's now 3 years later and he's doing so well, I'm so proud of how far he's come. 

He's in a wheelchair at times, and has aphasia and right side paralysis.

He's lost soo many friends, it's been heartbreaking.

It's been so hard on him and..it's been so hard on me. Often I feel ignored by others and my struggles and pain are ignored because HE had the stroke.

The impact this has on the loving partner is often ignored and you just have to suck it up. 

And if this happens over and over again and the partner does not look after their own mental health you can end up with compassion fatigue and that really is a relationship killer!"
p0085,"Is anyone else with a learning disability sick of hearing about ""growth mindset""?",112,disability,"I experienced this a lot in highschool. I was in an online program that my school provided due to issues with anxiety ADHD that made it nearly impossible to learn in a traditional classroom setting. Basically, instead of attending normal classes, we went to a small building on the school property and worked independently online, having teachers there to help if we needed it. The administrator of this program who also worked as one of the teachers was such a bitch to me about me having ADHD, and when I became severely anorexic which caused even more learning issues due to malnourishment, it got even worse. She had this mindset that anyone who didn't work to her standards just ""wasn't trying,"" no matter what their situation was, and treated people with mental health and/or learning issues like we were being actively malicious and defiant. She always tried to frame how she treated us as ""giving us motivation"" and ""making sure that we worked to the best of our ability,"" but instead of doing any of that, she just treated us like we were supposed to be robots, working nonstop not only in class, but at home as well, with no life apart from schoolwork. 

For example, one day, I was having more difficulty than usual with focusing and was fidgeting a lot. She came up to me and started bitching at me about not working as much as I ""should,"" despite the fact that I was ahead of my classmates in terms of overall progress for the year because I pushed myself to complete as many lessons as I could every day. I apologized and told her that I have ADHD and that I was still in the process of figuring out what meds help me manage my symptoms. She told me, ""No, you're just being insubordinate and don't want to work. If you can't control your ADHD, that's your problem. I should just expell you right now."" She fucking threatened to expell me, which she didn't even have the power to do, because I have ADHD. 

Her behavior continued, despite all the teachers defending me and trying to explain that I not only had a learning disability but was dealing with an eating disorder that caused severe malnourishment. I had learned to ignore her for the most part until my senior year. The shit she said to me made me immediately walk out of class and drop out. A couple weeks before school started, I was in a severe wreck that nearly took my life. The two biggest injuries that impacted my schoolwork was my back being broken in 6 places (can't sit up for very long without severe pain) and a brain hemorrhage (caused cognitive and functional issues). Because of the wreck, I was in the hospital when school started and couldn't go back to school for a few months, which meant I was quite a bit behind on my classwork. When I did finally get back to school, I worked my ass off to get caught up, though it was pretty much impossible when I started so far behind and was still dealing with my injuries, which caused me to need to go home early a lot of days. One day, she came up to me as soon as I got there and immediately started her bullshit. I told her that she couldn't reasonably expect me to have made the same amount of progress as my classmates given my situation. She told me that if I didn't finish my remaining work, at least half a year's worth, in the next 2 months, she wouldn't even allow me to come back next year and finish my classes, and that she would make sure I would never have a chance to graduate from highschool at all. I just gathered my stuff and left because there's no reason I should destroy my mental and physical health to do something that was basically impossible for someone in my position to do, only for me to not be able to graduate anyway. I sent the HS principal an email stating that I was officially dropping out and told him exactly what the program administrator said. Apparently, she got in trouble for it because when I came back to turn in my school laptop, she tried to say she ""didn't mean I actually wasn't allowed to graduate"" and ""was just trying to 'motivate' me."" Telling a student that you'll take away their ability to graduate because they were in a life threatening car wreck which happened to cause them to fall behind on schoolwork is not motivating in any way, it's just fucked up."
p0086,people with mental disabilities do you feel like you’re treated weirdly by physically disabled people?,109,disability,"That really sucks, I'm really sorry that's been your experience :( For me, it's been the exact reverse. I am physically disabled (with mental health issues as well but the physical disabilities are much more disabling for me) and I had to leave my school's disability advocacy group because it was full of people with mental disabilities who were ableist towards me with my physical disability -- to list just one example, telling me not to ""complain"" about the distance between my dorm and the dining hall because their dorm was further, when they can walk perfectly fine and I'm the one who skips meals because I physically cannot make it to the dining hall and whose mobility is so bad that I've recently been prescribed a custom wheelchair. I am telling you this not to be like ""um you're wrong actually people with physical disabilities get discriminated against people with mental disabilities 🤓"", not at all. Just to say that unfortunately, any kind of disabled person can be ableist. We always tell abled people that disabled people are not a monolith, and it's true. It really sucks that sometimes disabled people beat down on other disabled people who aren't like them. We really need to stick together and advocate for each other because it only helps everyone in the long run!
(I am both physically disabled and neurodivergent.) I found the opposite to be true actually. There are a lot of folks with mental illness who refuse to identify as disabled. They like to seperate mental illness from disability because they still have internalized ableism. There often conversations and advocacy around ""mental health"" but they *never* identify or view themselves as disabled. 


However, on both sides, there is a long history of disabilities being segregated from each other - charities work that focuses on one disability only. This is in line with the charity and medical model of disability, which wants society to view disabilities as individual medical conditions that need to be cured. Disability people have been taught from the beginning to separate ourselves by ""medical condition"" or individual disability. 


We all need to work on cross-disability solidarity for sure. Some folks with mental health issues need to shed there internalized ableism and not shy away from the disability label. And some visibly physically disabled people need to expand their own definition of disability to include and support folks with invisible disabilities.


It's tough. We've all be taught a bunch of ableism garbage that we need to unlearn. But everyone is at a different stage of unlearning.
Sort of?

In my experience the overwhelming majority of people with physical disabilities are extremely chill and supportive. I mean, mental illness is five times more common in people with physical disabilities, so that dude with the cane probably understands psychiatric conditions pretty intimately, man. In my experience if you tell someone who's stuck at home due to shitty mobility options or whatever that you are also stuck at home due to agoraphobia, their reaction is, nine times out of ten, ""it sucks, right?"" and not ""ACTUALLY I'm stuck at home for real while you're just stuck at home for pretend"" or whatever. Like it happens but it's extremely rare.

With that said, I'm schizophrenic and have run into a lot of disabled people, both physically and cognitively disabled, who only understand that in terms of stereotypes, like the idea that missing a dose makes a schizophrenic dangerous, or that our behaviour in states of psychosis is our ""true selves"" coming out. **I blame the poor public education around mental health** and what psychiatric conditions can really do to people in extreme cases for that, not disabled people as a demographic that should be held to some kind of exceptional standard just because they're disabled, if that makes sense.

Although, if you want to see bad opinions galore, mention body integrity identity disorder. [This is the ONLY chill take I've ever seen on it personally](https://www.youtube.com/watch?v=1pyw6ORugUU) ([follow-up video](https://youtu.be/GAouhje5Vm8?si=fr07CLqqIU9ALa4P)) but it's not hard to find old posts of people dunking on ""trans-abled"" people and by extension ""crazy people"" without any empathy or understanding of the psychiatric condition.
I have mental (bipolar II, anxiety) and physical (degenerative disc disease, fibromyalgia) and have never been treated differently by people with physical disabilities. 

The people who have treated me the worst were perfectly able bodied, and seemingly mentally stable who were freaked out by mental health disorders and made my life a hell.
As someone who's posts could be taken this way sometimes I think some clarification is needed. While I can only speak for myself and the opinions I have offered, it's not a case of diminishing or bashing mental health as an inferior or lesser form of disability. 

My bugbear is people who are self diagnosing based off of stuff like ""I watched some tiktoks and they convinced me I have ADHD/bipolar/ocd but no Dr will sign me off so I cant get benefits.""
I make myself feel weird bc society (social services, mental health professionals, peers) think my disabilities can be cured or are just a rough patch in life.
For me it’s hard to not envy other physically disabled people because of how much my physical symptoms are shrugged off as being in my head. A friend of mine was in the same boat; physically and mentally disabled but having her physical symptoms shrugged off and her concerns ignored while being accused of being a hypochondriac. Then one day about a year ago she had a grand mal seizure. Finally they couldn’t ignore her anymore and she’s got specialists for her physical AND mental health assigned to her now. 

I’ve been being gaslit for years over physical symptoms that are just getting worse and worse. Even though I’ve actually had a psychiatrist *and* a psychologist confirm that they’re not ‘in my head’, I continue to be gaslit and shrugged off. Now, am I to the point that I wish I’d just collapse with some major symptom so they **have** to stop gaslighting me? You bet your ass. Do I actually *want* my symptoms to get that bad? Obviously not. I’m just so desperate and tired of being brushed aside because someone slapped a diagnosis on me that the medical community thinks means I’m a ‘troublemaker’.

But this is all to do with how doctors treat me while having both. I’ve never had another disabled person invalidate me.
It's also been the same for me. I have both, but primarily physical disabilities (chronic illnesses) that precede my mental health issues. 

I think that the most frustrating aspect for mw js when people try to frame mental illnesses like ""What if you had a disability nobody could see!? People never say this ableist stuff to people with physical disabilities!!"" And I'm sitting here with my invisible illnesses like 😬
I think it’s also worth mentioning that, contrary to (seemingly) popular belief, a majority of physically disabled people aren’t neurotypical. Many of us have developmental disorders (e.g. autism or ADHD), and it’s also very common to develop mental illnesses such as depression, anxiety, PTSD, etc. as a result of our experiences as physically disabled people (many of us experience abuse from family or our partners, get bullied by our peers, or have medical trauma). Hell, sometimes we even start out with mental health conditions that end up causing or contributing to our physical health problems! (Psychological trauma is thought to play a part in some health conditions, such as fibromyalgia, autoimmune diseases, etc.)

Able-bodied mentally disabled people have a lot more in common with physically disabled people than they may think, but a lot of them still accuse us of being neurotypical when we push back against their ableism toward us. It’s very frustrating. Showing solidarity would be a lot more helpful to the both of us in the long run, but othering and attacking us isn’t productive at all.
Honestly? I'd bet on internalized able-ism. I was guilty of it for a lot of years as a kid. My sibling was higher support needs than I, and I was got so angry he couldn't just lie or mask like I did. Like ""don't you want to be *normal?*"" ""Just lie it's not that hard!"" ""Come on and just stop doing that!"" Which I've apologized profusely for and adapted for. 

So there's a lot of ""we can choose to mask, we should 'try to be normal', why do you get special language and recognitions and supports?!"" kind of lashing out without understanding the parallels that exist there. For  instance: my sibling is just starting to pick up on spoon theory for Autism and anxiety. And mobility aids aren't very different from stimming aids, and both are discriminated against. 

I'd also argue there's a huge lack of recognition about how physical disabilities were fought for and still are constantly because they see the effects of the ADA every single day. But a lot of people don't understand that Autism wasn't recognized 25-30 years ago and the supports they have now were not the norm - that is to say that we are all *still* fighting.  And there's half a dozen posts every week that talk about invisible disabilities being ignored because the media portrays them as being easy to take care of.

There's likely also the ""well I was born with this, *you* developed it!"" resentment which is so utterly ironic because on the physical side you have older people telling you that ""you haven't earned your pain, you're too young/didn't work a hard enough job/have kids/whatever justification"" on top of genetic conditions. 

And most importantly: intersectionality! LGBTQ+, racial minorities, mental health, physical health, and abuse victims often check multiple boxes. We all are parallels of each other and all have similar struggles. And we have to band together because this is just another way to keep us divided and unable to fight for our rights."
p0087,Do you ever feel fake with your disability?,106,disability,"I have multiple mental health issues ranging from PTSD, anxiety, depression, and severe insomnia. I have sensitive asthma to the point where I’ve been in the hospital for it multiple times or had to go the ER. Most of all I’m Type 1 diabetic and the amount of people who tell me thats a fake disability never ceases to amaze me. Idk any other auto immune disease thats not curable and you’re forced to spend $1000+ to survive monthly. Like I don’t have insulin then I’d just die. Of course no one cares here in America as long as ur paying Big Pharma. Having your blood sugar too high feels like shit having it to low feels like shit. I’ve puked out my brains for hours and days at a time due to low AND high blood sugars. I’ve gone to the hospital more times then I can count bc the insurance refusing to cover my medical supplies causing me to go into DKA. Fun fact: One time this happen and my boyfriend (at the time) was screwing my mother in my car in the parking lot of the hospital… geeee I wonder how I got all those mental health issues. 🤔 (yes thats meant to be funny bc idk how tf else to handle all this trauma but obviously thats not all that caused it)
You aren’t though just so you know. For me a lot of my disabilities are not seen like my mental health bipolar,cPTSD, severe anxiety, and adhd. The other are health related like my hashimotos, heart conditions,Ibs, severe asthma, essential temors, and much more. So, on days when I feel a little bit better it’s hard for me to feel not like I’m faking or it’s just not so bad even though I’m still trying to figure out another health condition I might have."
